year,month,day,minute,id_str,source,text,retweet_count,favorite_count,is_retweet,created_at
2018,10,25,1401,1055600267331285002,Twitter for iPhone,The Service Members who died that day included brave young Marines just out of high school accomplished officers in the middle of their military careers and enlisted men who had served in theaters all over the world... https://t.co/82Wkru7JAb,11772,47955,false,10-25-2018 23:21:30
2018,10,25,1399,1055599805395812352,Twitter for iPhone,In 1983 roughly 1800 Marines were in Beirut to keep the peace in a Nation torn apart by Civil War. Terrorists had bombed the U.S. Embassy earlier that year killing 63 people including 17 Americans... https://t.co/Mp73AYv7J0,10271,39709,false,10-25-2018 23:19:40
2018,10,25,1393,1055598350228246528,Twitter for iPhone,We are gathered together on this solemn occasion to fulfill our most reverent and sacred duty. 35 years ago 241 American service members were murdered in the terrorist attack on our Marine Barracks in Beirut Lebanon. Today we honor our fallen heroes... https://t.co/zPgjSFj9BM,14730,57759,false,10-25-2018 23:13:53
2018,10,25,1239,1055559438977900544,Twitter for iPhone,.@BrucePoliquin from Maine is a great Congressman. He is in a tough fight against a very liberal Nancy Pelosi Democrat. Bruce has helped bring JOBS back to his State and totally protects your Great Second Amendment. We need to keep Bruce in Washington. He has my Full Endorsement!,12528,45253,false,10-25-2018 20:39:16
2018,10,25,1224,1055555764901822466,Twitter for iPhone,.@MikeDunleavyGov will make a fantastic Governor of Alaska. Mike is for Energy and Jobs is tough on Crime loves our Vets and our Great Second Amendment. Mike has my Complete and Total Endorsement!,9510,36542,false,10-25-2018 20:24:40
2018,10,25,1222,1055555312864952321,Twitter for iPhone,.@LloydSmuckerPA is doing a great job for the people of Pennsylvania. He is strong on the Border Crime the Military our Vets and the 2nd Amendment. Lloyd has my Total Endorsement!,9254,34456,false,10-25-2018 20:22:52
2018,10,25,1196,1055548549595873280,Twitter for iPhone,.@Troy_Balderson of Ohio is doing a great job as your Congressman already very respected in Washington. Get out and VOTE for Troy - we need him – great guy – has my Total Endorsement!,9604,36186,false,10-25-2018 19:56:00
2018,10,25,1195,1055548456469778432,Twitter for iPhone,.@JohnChrin of Pennsylvania is fantastic. He is strong on the Border Crime the Military our Vets and the 2nd Amendment. He is a powerful vote for #MAGA and loves the Great State of Pennsylvania. Please get out and vote for John he has my Total and very Strong Endorsement!,8754,32478,false,10-25-2018 19:55:37
2018,10,25,1127,1055531231495024642,Twitter for iPhone,...I agree with their stance 100% and the United States is likewise taking a very hard line on illegal immigration. The Prime Minister is working very hard on the economy of Italy - he will be successful!,11382,47004,false,10-25-2018 18:47:11
2018,10,25,1127,1055531230022766592,Twitter for iPhone,Just spoke with Prime Minister @GiuseppeConteIT of Italy concerning many subjects including the fact that Italy is now taking a very hard line on illegal immigration...,13415,55440,false,10-25-2018 18:47:10
2018,10,25,1122,1055529948046331904,Twitter for iPhone,Spoke with French President @EmmanuelMacron this morning. Discussed many topics including the very exciting upcoming visit to Paris where @FLOTUS Melania and I will attend the Armistice Day Centennial Commemoration!,8187,38899,false,10-25-2018 18:42:05
2018,10,25,1111,1055527191235227648,Twitter for iPhone,To those in the Caravan turnaround we are not letting people into the United States illegally. Go back to your Country and if you want apply for citizenship like millions of others are doing!,40876,139950,false,10-25-2018 18:31:07
2018,10,25,981,1055494636775657478,Twitter for iPhone,“Remarks by President Trump on a Year of Historic Progress and Action to Combat the Opioid Crisis” https://t.co/YBTzMSOozW https://t.co/njGYwHff4t,9329,37096,false,10-25-2018 16:21:46
2018,10,25,837,1055458320390217728,Twitter for iPhone,The New York Times has a new Fake Story that now the Russians and Chinese (glad they finally added China) are listening to all of my calls on cellphones. Except that I rarely use a cellphone &amp; when I do it’s government authorized. I like Hard Lines. Just more made up Fake News!,27987,96454,false,10-25-2018 13:57:27
2018,10,25,678,1055418269270716418,Twitter for iPhone,A very big part of the Anger we see today in our society is caused by the purposely false and inaccurate reporting of the Mainstream Media that I refer to as Fake News. It has gotten so bad and hateful that it is beyond description. Mainstream Media must clean up its act FAST!,48399,171125,false,10-25-2018 11:18:18
2018,10,25,665,1055414972635926528,Twitter for iPhone,Brandon Judd of the National Border Patrol Council is right when he says on @foxandfriends that the Democrat inspired laws make it tough for us to stop people at the Border. MUST BE CHANDED but I am bringing out the military for this National Emergency. They will be stopped!,21536,82461,false,10-25-2018 11:05:12
2018,10,25,654,1055412328571850753,Twitter for iPhone,The so-called experts on Trump over at the New York Times wrote a long and boring article on my cellphone usage that is so incorrect I do not have time here to correct it. I only use Government Phones and have only one seldom used government cell phone. Story is soooo wrong!,19787,74368,false,10-25-2018 10:54:42
2018,10,25,103,1055273659563171840,Twitter for iPhone,Just leaving Wisconsin. @ScottWalker and @LeahVukmir are fantastic people badly needed for our Country! #MAGA https://t.co/6dLOBO6UQy,12714,52132,false,10-25-2018 01:43:41
2018,10,24,1434,1055246191443763201,Twitter for iPhone,Just arrived in Wisconsin to help two great people @ScottWalker and @LeahVukmir! https://t.co/Pu1Yyl5K0G,15330,65598,false,10-24-2018 23:54:32
2018,10,24,1135,1055170989682757632,Twitter for iPhone,The safety of the American People is my highest priority. I have just concluded a briefing with the FBI Department of Justice Department of Homeland Security and the U.S. Secret Service... https://t.co/nEUBcq4NOh,21767,81738,false,10-24-2018 18:55:42
2018,10,24,964,1055127893112696832,Twitter for iPhone,I agree wholeheartedly! https://t.co/ndzu0A30vU,22414,99508,false,10-24-2018 16:04:27
2018,10,24,765,1055077740792160256,Twitter for iPhone,Republicans will totally protect people with Pre-Existing Conditions Democrats will not! Vote Republican.,25199,95829,false,10-24-2018 12:45:10
2018,10,24,755,1055075245743374336,Twitter for iPhone,Brian Kemp will be a GREAT Governor of Georgia. Stacey Abrams will destroy the State. Sooooo important get out and VOTE for Brian!,17295,63399,false,10-24-2018 12:35:15
2018,10,24,716,1055065538890735616,Twitter for iPhone,We are a great Sovereign Nation. We have Strong Borders and will never accept people coming into our Country illegally!,29913,124811,false,10-24-2018 11:56:41
2018,10,24,712,1055064484644089856,Twitter for iPhone,For those who want and advocate for illegal immigration just take a good look at what has happened to Europe over the last 5 years. A total mess! They only wish they had that decision to make over again.,36361,126384,false,10-24-2018 11:52:29
2018,10,23,1398,1054874705491120133,Twitter for iPhone,I agree with President Obama 100%! https://t.co/PI3aW1Zh5Q,81032,224967,false,10-23-2018 23:18:23
2018,10,23,1311,1054852929419730944,Twitter for iPhone,RT @DeptofDefense: Never forgotten!On Oct. 23 1983 the #Beirut Marine Barracks bombing took the lives of 241 #Marines #sailors and #sol…,12585,0,true,10-23-2018 21:51:51
2018,10,23,1003,1054775397798178816,Twitter for iPhone,Billions of dollars are and will be coming into United States coffers because of Tariffs. Great also for negotiations - if a country won’t give us a fair Trade Deal we will institute Tariffs on them. Used or not jobs and businesses will be created. U.S. respected again!,23628,102177,false,10-23-2018 16:43:46
2018,10,23,989,1054771761500377090,Twitter for iPhone,#JobsNotMobs https://t.co/0pWiwCHGbh https://t.co/DsJ82fArcq,12209,44485,false,10-23-2018 16:29:19
2018,10,23,983,1054770300359991297,Twitter for iPhone,https://t.co/6R85sd4LLD,10039,41052,false,10-23-2018 16:23:30
2018,10,23,941,1054759617165754372,Twitter for iPhone,Congressman John Faso of New York has worked hard and smart. Strong on Crime Borders and our 2nd Amendment John is respected by all. Vote for John. He has my complete and total Endorsement!,13489,51895,false,10-23-2018 15:41:03
2018,10,23,924,1054755401651179521,Twitter for iPhone,The people of Puerto Rico are wonderful but the inept politicians are trying to use the massive and ridiculously high amounts of hurricane/disaster funding to pay off other obligations. The U.S. will NOT  bail out long outstanding &amp; unpaid obligations with hurricane relief money!,24364,93172,false,10-23-2018 15:24:18
2018,10,23,833,1054732552488083459,Twitter for iPhone,Jay Webber of New Jersey running for Congress is doing a great job against a person who is looking to raise Taxes substantially. Jay wants big Tax Cuts and Changes. A Harvard graduate and father of seven Jay will be great for New Jersey and get the job done-and I will help!,14961,59021,false,10-23-2018 13:53:31
2018,10,23,262,1054588738641178624,Twitter for iPhone,Congressman Erik Paulsen of the Great State of Minnesota has done a fantastic job in cutting Taxes and Job Killing Regulations. Hard working and very smart. Keep Erik in Congress. He has my Strong Endorsement!,15158,61448,false,10-23-2018 04:22:03
2018,10,23,164,1054564283634266112,Twitter for iPhone,We send our deepest condolences to @RepLouBarletta and the entire Barletta family on the passing of his brother. Lou has been working so hard despite this terrible situation for the people of Pennsylvania. Our thoughts and prayers are with Lou and the entire Barletta family!,14268,67149,false,10-23-2018 02:44:52
2018,10,23,150,1054560552117133313,Twitter for iPhone,Today’s Democrat Party would rather protect criminal aliens than AMERICAN CITIZENS - which is why the Democrats must be voted OUT of OFFICE! #JobsNotMobs https://t.co/0pWiwCq4MH https://t.co/axUEOzBAsZ,18426,60707,false,10-23-2018 02:30:03
2018,10,23,133,1054556416155910144,Twitter for iPhone,At stake in this Election is whether we continue the extraordinary prosperity we have achieved - or whether we let the Radical Democrat Mob take a giant wrecking ball to our Country and our Economy! #JobsNotMobs https://t.co/POhRivI1BZ,17908,60991,false,10-23-2018 02:13:36
2018,10,23,126,1054554601192488960,Twitter for iPhone,We send our deepest condolences to Lou and the entire Barletta family - he has been working so hard despite this terrible situation for the people of Pennsylvania. Our thoughts and prayers are with you Lou!,3313,13837,false,10-23-2018 02:06:24
2018,10,23,90,1054545561234427905,Twitter for iPhone,THANK YOU HOUSTON TEXAS. Get out and https://t.co/0pWiwCHGbh! #JobsNotMobs https://t.co/JXiFjDFH6R https://t.co/Ebc1JfgUys,17063,61082,false,10-23-2018 01:30:28
2018,10,23,83,1054543818249388034,Twitter for iPhone,https://t.co/flKQuv9MnX,12301,46254,false,10-23-2018 01:23:33
2018,10,22,1295,1054486312701517824,Twitter for iPhone,Massive crowds inside and outside of the @ToyotaCenter in Houston Texas. Landing shortly - see everyone soon! #MAGA🇺🇸https://t.co/0pWiwCq4MH https://t.co/tj5S6Z2GY7,17087,66231,false,10-22-2018 21:35:03
2018,10,22,1195,1054461380797943809,Twitter for iPhone,Let’s go FLORIDA! https://t.co/0pWiwCq4MH https://t.co/6kaVM1TaiB,11862,40103,false,10-22-2018 19:55:58
2018,10,22,1194,1054460902076862466,Twitter for iPhone,Last day to register to VOTE in Alabama California South Dakota and Wyoming! #JobsNotMobs https://t.co/0pWiwCq4MH https://t.co/hmQgqgmbyE,9748,33283,false,10-22-2018 19:54:04
2018,10,22,1167,1054454173142380544,Twitter for iPhone,WOW - thank you Houston Texas! I am departing @Andrews_JBA now. See you in a few hours!! #MAGA🇺🇸 https://t.co/UxZCo19cxT,14478,56395,false,10-22-2018 19:27:20
2018,10,22,1158,1054451956608049152,Twitter for iPhone,....I say of course they’re low - because for the first time in 50 years I am making them pay a big price for doing business with America. Why should they like me? — But I still like them!,14020,72145,false,10-22-2018 19:18:31
2018,10,22,1158,1054451954397667328,Twitter for iPhone,The Fake News Media has been talking about recent approval ratings of me by countries around the world including the European Union as being very low....,13334,61728,false,10-22-2018 19:18:31
2018,10,22,1080,1054432329710608385,Twitter for iPhone,“America: the Cleanest Air in the World - BY FAR!” https://t.co/rMtxHSnof4,16780,56322,false,10-22-2018 18:00:32
2018,10,22,1072,1054430376557535232,Twitter for iPhone,“Shock report: US paying more for illegal immigrant births than Trump’s wall” https://t.co/FX3ljN7kPS,27518,62944,false,10-22-2018 17:52:46
2018,10,22,778,1054356359096033281,Twitter for iPhone,Big Night In Texas!!!!,14499,70681,false,10-22-2018 12:58:39
2018,10,22,777,1054356145798856704,Twitter for iPhone,Guatemala Honduras and El Salvador were not able to do the job of stopping people from leaving their country and coming illegally to the U.S. We will now begin cutting off or substantially reducing the massive foreign aid routinely given to them.,37946,141618,false,10-22-2018 12:57:48
2018,10,22,769,1054354059535269888,Twitter for iPhone,Every time you see a Caravan or people illegally coming or attempting to come into our Country illegally think of and blame the Democrats for not giving us the votes to change our pathetic Immigration Laws! Remember the Midterms! So unfair to those who come in legally.,38274,135930,false,10-22-2018 12:49:31
2018,10,22,757,1054351078328885248,Twitter for iPhone,Sadly it looks like Mexico’s Police and Military are unable to stop the Caravan heading to the Southern Border of the United States. Criminals and unknown Middle Easterners are mixed in. I have alerted Border Patrol and Military that this is a National Emergy. Must change laws!,38130,142372,false,10-22-2018 12:37:40
2018,10,22,746,1054348185160896513,Twitter for iPhone,Congressman Tom Reed of New York’s 23rd District has done a great job. He has my complete and total Endorsement!,11270,48333,false,10-22-2018 12:26:10
2018,10,22,109,1054187956024590336,Twitter for iPhone,Ron @RonDeSantisFL DeSantis had a great debate victory tonight against Andrew Gillum a mayor who presides over one of the worst run and most corrupt cities in Florida. Ron will build on the great job done by Governor Rick Scott. Gillum will make Florida the next Venezuela!,22938,78628,false,10-22-2018 01:49:29
2018,10,21,1368,1054142516881248258,Twitter for iPhone,Facebook has just stated that they are setting up a system to “purge” themselves of Fake News. Does that mean CNN will finally be put out of business?,47085,185631,false,10-21-2018 22:48:55
2018,10,21,1166,1054091502585069568,Twitter for iPhone,Best Jobs Numbers in the history of our great Country! Many other things likewise. So why wouldn’t we win the Midterms? Dems can never do even nearly as well! Think of what will happen to your now beautiful 401-k’s!,24103,99002,false,10-21-2018 19:26:12
2018,10,21,1154,1054088531629490178,Twitter for iPhone,The Caravans are a disgrace to the Democrat Party. Change the immigration laws NOW!,26448,104840,false,10-21-2018 19:14:24
2018,10,21,1151,1054087893034172418,Twitter for iPhone,Full efforts are being made to stop the onslaught of illegal aliens from crossing our Souther Border. People have to apply for asylum in Mexico first and if they fail to do that the U.S. will turn them away. The courts are asking the U.S. to do things that are not doable!,28720,110821,false,10-21-2018 19:11:52
2018,10,21,165,1053839625679183872,Twitter for iPhone,Watched North Dakota’s Rep. Kevin Cramer easily win debate with Senator Heidi Heitkamp. Great job Kevin you will be a great Senator!,20939,94030,false,10-21-2018 02:45:20
2018,10,21,36,1053807130120200192,Twitter for iPhone,All levels of government and Law Enforcement are watching carefully for VOTER FRAUD including during EARLY VOTING. Cheat at your own peril. Violators will be subject to maximum penalties both civil and criminal!,44969,141354,false,10-21-2018 00:36:13
2018,10,20,1212,1053740855016574976,Twitter for iPhone,Beautiful afternoon in Elko Nevada. Thank you! Get out and VOTE TODAY!! #MAGA🇺🇸#JobsNotMobs https://t.co/0pWiwCq4MH https://t.co/AKfGzjrqCM,11650,49132,false,10-20-2018 20:12:52
2018,10,20,990,1053684769991454721,Twitter for iPhone,Heading to Nevada to help a man who has become a good friend Senator Dean Heller. He is all about #MAGA and I need his Help and Talent in Washington. Also Adam Laxalt will be a GREAT GOVERNOR and has my complete and total Endorsement. Winners Both!,14766,61446,false,10-20-2018 16:30:00
2018,10,20,979,1053682023066288128,Twitter for iPhone,Leaving Arizona after a fantastic Rally last night in Mesa honoring and for Martha @RepMcSally McSally. She is an inspiration &amp; will be a GREAT SENATOR for the people of Arizona. Her opponent is a Nancy Pelosi puppet really bad for State. Early Voting NOW! Will be back soon.,15261,65875,false,10-20-2018 16:19:05
2018,10,20,903,1053662989272793089,Twitter for iPhone,Rick Scott is known as easily one of the best Governors in the USA. Florida is setting records in almost every category of success. Amazing achievement-the envy of the World. Ron DeSantis will build on this success. His incompetent opponent will destroy Florida - next Venezuela!,18328,66573,false,10-20-2018 15:03:27
2018,10,20,896,1053661248217202688,Twitter for iPhone,Ron @RonDeSantisFL DeSantis is working hard. A great Congressman and top student at Harvard &amp; Yale Ron will be a record setting governor for Florida. Rick Scott gave him tremendous foundations to further build on. His opponent runs one of the worst &amp; most corrupt cities in USA!,18693,64423,false,10-20-2018 14:56:32
2018,10,20,886,1053658596712431616,Twitter for iPhone,Get out and Early Vote for Brian Kemp. He will be a GREAT GOVERNOR for the State of Georgia!,16147,61515,false,10-20-2018 14:46:00
2018,10,20,883,1053657849606234112,Twitter for iPhone,Georgia Secretary of State Brian Kemp will be a great governor. He has been successful at whatever he has done and has prepared for this very difficult and complex job for many years. He has my Strong Endorsement. His opponent is totally unqualified. Would destroy a great state!,17132,66318,false,10-20-2018 14:43:02
2018,10,20,875,1053655992649506821,Twitter for iPhone,If the Democrats would stop being obstructionists and come together we could write up and agree to new immigration laws in less than one hour. Look at the needless  pain and suffering that they are causing. Look at the horrors taking place on the Border. Chuck &amp; Nancy call me!,32271,110983,false,10-20-2018 14:35:39
2018,10,20,197,1053485357734408192,Twitter for iPhone,Beautiful evening in Mesa Arizona with GREAT PATRIOTS - thank you! https://t.co/0pWiwCq4MH #MAGARally🇺🇸replay: https://t.co/6vHEaB37VH https://t.co/pHmU6pMKh7,11878,50095,false,10-20-2018 03:17:36
2018,10,20,193,1053484232138358785,Twitter for iPhone,This was outside of the massive totally full hangar tonight in Mesa Arizona! https://t.co/0pWiwCq4MH #MAGA🇺🇸 https://t.co/7mx98y515I,24321,91742,false,10-20-2018 03:13:08
2018,10,20,83,1053456620334678016,Twitter for iPhone,On my way - see you all shortly! https://t.co/0pWiwCq4MH https://t.co/ahDmLiwPZi,11712,54708,false,10-20-2018 01:23:25
2018,10,20,51,1053448472156749824,Twitter for iPhone,WOW - Mesa Arizona! Look forward to joining everyone soon. Something’s happening!! #MAGA🇺🇸 https://t.co/z6LNGYoICO,16487,67714,false,10-20-2018 00:51:02
2018,10,19,1427,1053432380860456960,Twitter for iPhone,This is what it is all about for the Republican Party! #JobsNotMobs https://t.co/8OabccPec5,23317,84929,false,10-19-2018 23:47:06
2018,10,19,1121,1053355470449127424,Twitter for iPhone,#JobsNotMobs! https://t.co/U1suRW5j6G,21474,73957,false,10-19-2018 18:41:29
2018,10,19,1054,1053338516501889025,Twitter for iPhone,Beto O’Rourke is a total lightweight compared to Ted Cruz and he comes nowhere near representing the values and desires of the people of the Great State of Texas. He will never be allowed to turn Texas into Venezuela!,27490,99902,false,10-19-2018 17:34:07
2018,10,19,1046,1053336553391452161,Twitter for iPhone,Secretary of State Mike Pompeo was never given or shown a Transcript or Video of the Saudi Consulate event. FAKE NEWS!,32864,80867,false,10-19-2018 17:26:19
2018,10,19,844,1053285828892463109,Twitter for iPhone,When referring to the USA I will always capitalize the word Country!,20219,109104,false,10-19-2018 14:04:45
2018,10,19,842,1053285341610668034,Twitter for iPhone,Congressman Andy Biggs is doing a great job for Arizona and our Country! https://t.co/V561vXRpzx,11391,46857,false,10-19-2018 14:02:49
2018,10,19,203,1053124336637247493,Twitter for iPhone,#JobsNotMobs!,29936,99824,false,10-19-2018 03:23:02
2018,10,19,191,1053121500151074817,Twitter for iPhone,Jon Tester says one thing to voters and does the EXACT OPPOSITE in Washington. Tester takes his orders form Pelosi &amp; Schumer. Tester wants to raise your taxes take away your 2A open your borders and deliver MOB RULE. Retire Tester &amp; Elect America-First Patriot Matt Rosendale!,22612,77967,false,10-19-2018 03:11:46
2018,10,19,114,1053102147888328704,Twitter for iPhone,Thank you Missoula Montana. Get out and VOTE for @MattForMontana and @GregForMontana!! #MAGA🇺🇸https://t.co/6XgaceUu1e https://t.co/nEndInSOhw,11798,46566,false,10-19-2018 01:54:52
2018,10,19,11,1053076069564071936,Twitter for iPhone,The only thing keeping Tester alive is he has millions and millions of dollars from outside liberals and leftists who couldn’t care less about our Country!,17891,70652,false,10-19-2018 00:11:14
2018,10,19,4,1053074465150578688,Twitter for iPhone,Will be landing soon. Looking forward to seeing our next Senator from Montana Matt Rosendale. He will represent our Country well far better than Jon Tester who will vote with Cryin’ Chuck Schumer and Nancy Pelosi - never with us!,13725,62964,false,10-19-2018 00:04:52
2018,10,18,1429,1053070661302669312,Twitter for iPhone,Prime Minister @AbeShinzo of Japan has been working with me to help balance out the one-sided Trade with Japan. These are some of the investments they are making in our Country - just the beginning! https://t.co/ib2yB3Akkt,14296,49165,false,10-18-2018 23:49:45
2018,10,18,1371,1053056054295113728,Twitter for iPhone,Thank you Mexico we look forward to working with you! https://t.co/wf7sE0DHFT,22503,79784,false,10-18-2018 22:51:42
2018,10,18,1282,1053033702253424640,Twitter for iPhone,Look forward to being there. Something’s happening! #MAGA https://t.co/Cev7giQexE,14087,53560,false,10-18-2018 21:22:53
2018,10,18,1204,1053013864244219904,Twitter for iPhone,Can you believe this and what Democrats are allowing to be done to our Country? https://t.co/4aDpASkjIU,26802,68749,false,10-18-2018 20:04:03
2018,10,18,1183,1053008701026693122,Twitter for iPhone,All Republicans support people with pre-existing conditions and if they don’t they will after I speak to them. I am in total support. Also Democrats will destroy your Medicare and I will keep it healthy and well!,28323,100783,false,10-18-2018 19:43:32
2018,10,18,1006,1052964059056885760,Twitter for iPhone,See you tonight Missoula Montana! #MAGARally🇺🇸https://t.co/2HZ66y4BS7,9902,41692,false,10-18-2018 16:46:09
2018,10,18,953,1052950726907969536,Twitter for iPhone,.@StateDept @SecPompeo outside of the West Wing after our meeting this morning in the Oval Office... https://t.co/4GrmMdOhS1,8854,35995,false,10-18-2018 15:53:10
2018,10,18,940,1052947510271111170,Twitter for iPhone,...the Crown Prince. He is waiting for the results of the investigations being done by the Saudis and Turkey and just gave a news conference to that effect.,7724,37374,false,10-18-2018 15:40:23
2018,10,18,940,1052947507238658049,Twitter for iPhone,Secretary of State Mike Pompeo returned last night from Saudi Arabia and Turkey. I met with him this morning wherein the Saudi situation was discussed in great detail including his meeting with...,9180,44253,false,10-18-2018 15:40:23
2018,10,18,808,1052914382986973184,Twitter for iPhone,Congressman @DaveBratVA7th is one of the hardest working and smartest people in Washington. He is strong on the Border Crime the Military our Vets and the 2nd Amendment. He is a powerful vote for MAGA and loves the Great State of Virginia. Dave has my Total Endorsement!,14048,54302,false,10-18-2018 13:28:45
2018,10,18,705,1052888451199262725,Twitter for iPhone,....The assault on our country at our Southern Border including the Criminal elements and DRUGS pouring in is far more important to me as President than Trade or the USMCA. Hopefully Mexico will stop this onslaught at their Northern Border. All Democrats fault for weak laws!,24348,90701,false,10-18-2018 11:45:43
2018,10,18,695,1052885781675687936,Twitter for iPhone,....In addition to stopping all payments to these countries which seem to have almost no control over their population I must in the strongest of terms ask Mexico to stop this onslaught - and if unable to do so I will call up the U.S. Military and CLOSE OUR SOUTHERN BORDER!..,40338,152091,false,10-18-2018 11:35:06
2018,10,18,685,1052883467430694912,Twitter for iPhone,I am watching the Democrat Party led (because they want Open Borders and existing weak laws) assault on our country by Guatemala Honduras and El Salvador whose leaders are doing little to stop this large flow of people INCLUDING MANY CRIMINALS from entering Mexico to U.S.....,23487,85795,false,10-18-2018 11:25:54
2018,10,18,123,1052741954918866944,Twitter for iPhone,Ever since his vicious and totally false statements about Admiral Ron Jackson the highly respected White House Doctor for Obama Bush &amp; me Senator John Tester looks to be in big trouble in the Great State of Montana! He behaved worse than the Democrat Mob did with Justice K!,24269,90585,false,10-18-2018 02:03:35
2018,10,17,1323,1052681628240281600,Twitter for iPhone,This afternoon it was my great honor to present @USMC Sergeant Major John Canley the Medal of Honor in the East Room of the @WhiteHouse! https://t.co/EI1DD4AkC9 https://t.co/6JJm1SRcQ9,11800,56547,false,10-17-2018 22:03:52
2018,10,17,1211,1052653446053154816,Twitter for iPhone,RT @USMC: LIVE from the White House: Sgt. Maj. John Canley becomes the 300th Marine to receive the Medal of Honor. https://t.co/sD93rrqaoZ,11270,0,true,10-17-2018 20:11:53
2018,10,17,1176,1052644447853453312,Twitter for iPhone,Congressman Neal Dunn (@DunnCampaign) of Florida has done an outstanding job at everything having to do with #MAGA. Now working hard on hurricane relief and rebuild. Strong on Crime strong on Borders loves our Military and our Vets. Neal has my highest Endorsement!,12380,47755,false,10-17-2018 19:36:08
2018,10,17,1164,1052641581650640903,Twitter for iPhone,College educated women want safety security and healthcare protections – very much along with financial and economic health for themselves and our Country. I supply all of this far better than any Democrat (for decades actually). That’s why they will be voting for me!,23267,101702,false,10-17-2018 19:24:44
2018,10,17,1072,1052618395722559488,Media Studio,https://t.co/mNkDYgu5sr,9619,38188,false,10-17-2018 17:52:36
2018,10,17,1061,1052615582560923648,Media Studio,https://t.co/MadlgNheSe,8593,34308,false,10-17-2018 17:41:26
2018,10,17,1058,1052614789828993024,Media Studio,https://t.co/CMxxW2fEDq,10953,39656,false,10-17-2018 17:38:17
2018,10,17,1049,1052612579099521024,Media Studio,https://t.co/afqHydsMB5,8415,34126,false,10-17-2018 17:29:30
2018,10,17,1038,1052609907344715777,Twitter for iPhone,“President Donald J. Trump is Following Through on His Promise to Cut Burdensome Red Tape and Unleash the American Economy”Read more: https://t.co/SrBaQzpq4E https://t.co/zF8fEsw3in,8985,35998,false,10-17-2018 17:18:53
2018,10,17,1031,1052608125839265792,Twitter for iPhone,RT @GOP: You can cast your ballot before Election Day in:➡️KS➡️NC➡️TNGet out and vote ➡️ https://t.co/YIO9A13Uio https://t.co/bxkCMApisn,6478,0,true,10-17-2018 17:11:48
2018,10,17,1031,1052608114346926081,Twitter for iPhone,RT @GOP: TODAY is the LAST day to register to vote in Massachusetts and Wisconsin!Register today ➡️ https://t.co/CZsNCAAomd https://t.co/3…,4617,0,true,10-17-2018 17:11:45
2018,10,17,828,1052556944068755456,Twitter for iPhone,Republicans must make the horrendous weak and outdated immigration laws and the Border a part of the Midterms!,17549,67029,false,10-17-2018 13:48:25
2018,10,17,825,1052556222459727872,Twitter for iPhone,Hard to believe that with thousands of people from South of the Border walking unimpeded toward our country in the form of large Caravans that the Democrats won’t approve legislation that will allow laws for the protection of our country. Great Midterm issue for Republicans!,25687,86364,false,10-17-2018 13:45:33
2018,10,17,760,1052539788190986240,Twitter for iPhone,“Network News gave Zero coverage to the Big Day the Stock Market had yesterday.” @foxandfriends,14261,59311,false,10-17-2018 12:40:15
2018,10,17,751,1052537536961306625,Twitter for iPhone,August job openings hit a record 7.14 million. Congratulations USA!,17195,76477,false,10-17-2018 12:31:18
2018,10,17,729,1052532141941301248,Twitter for iPhone,AP headline was very different from my quote and meaning in the story. They just can’t help themselves. FAKE NEWS!,14162,59763,false,10-17-2018 12:09:52
2018,10,17,720,1052529703800721408,Twitter for iPhone,Ted Cruz has done so much for Texas including massive cuts in taxes and regulations - which has brought Texas to the best jobs numbers in the history of the state. He watches carefully over your 2nd Amendment. O’Rourke would blow it all! Ted has long had my Strong Endorsement!,20414,80693,false,10-17-2018 12:00:11
2018,10,17,712,1052527724143763456,Twitter for iPhone,Watched the debate last night &amp; Beto O’Rourke who wants higher taxes and far more regulations is not in the same league with Ted Cruz &amp; what the great people of Texas stand for &amp; want. Ted is strong on Crime Border &amp; 2nd A loves our Military Vets Low Taxes. Beto is a Flake!,20677,78861,false,10-17-2018 11:52:19
2018,10,17,690,1052522197347119104,Twitter for iPhone,“Trump could be the most honest president in modern history. When you look at the real barometer of presidential truthfulness which is promise keeping he is probably the most honest president in American history. He’s done exactly what he said he would do.” Marc Thiessen WPost,22857,88617,false,10-17-2018 11:30:21
2018,10,17,159,1052388580734263297,Twitter for iPhone,Stock Market up 548 points today. Also GREAT jobs numbers!,13857,70895,false,10-17-2018 02:39:24
2018,10,17,156,1052387851088867330,Twitter for iPhone,Elizabeth Warren is being hammered even by the Left. Her false claim of Indian heritage is only selling to VERY LOW I.Q. individuals!,21021,93104,false,10-17-2018 02:36:30
2018,10,17,84,1052369731959820292,Twitter for iPhone,Anybody entering the United States illegally will be arrested and detained prior to being sent back to their country!,43244,172550,false,10-17-2018 01:24:30
2018,10,17,79,1052368431201341447,Twitter for iPhone,We have today informed the countries of Honduras Guatemala and El Salvador that if they allow their citizens or others to journey through their borders and up to the United States with the intention of entering our country illegally all payments made to them will STOP (END)!,36759,136248,false,10-17-2018 01:19:20
2018,10,16,1423,1052344365442588673,Twitter for iPhone,I will be interviewed tonight by Trish Regan on @FoxBusiness at 8:00 P.M. right after the great Lou Dobbs!,8380,45247,false,10-16-2018 23:43:42
2018,10,16,1408,1052340597900627968,Twitter for iPhone,RT @FoxBusiness: TONIGHT: @POTUS talks 2020 election in an exclusive interview with @trish_regan. Don't miss the full interview on 'Trish R…,7270,0,true,10-16-2018 23:28:44
2018,10,16,1130,1052270676982333442,Twitter for iPhone,WOW John James is making headway in Michigan. We are bringing jobs back to the State and the People of Michigan appreciate it. Debbie Stabenow has been no help if anything a major hindrance. John James is a star I hope the voters see it. Polls are tightening!,27460,98116,false,10-16-2018 18:50:54
2018,10,16,1120,1052268013876064256,Twitter for iPhone,...during the call and told me that he has already started and will rapidly expand a full and complete investigation into this matter. Answers will be forthcoming shortly.,10481,44668,false,10-16-2018 18:40:19
2018,10,16,1120,1052268011900555265,Twitter for iPhone,Just spoke with the Crown Prince of Saudi Arabia who totally denied any knowledge of what took place in their Turkish Consulate. He was with Secretary of State Mike Pompeo...,14134,53291,false,10-16-2018 18:40:18
2018,10,16,982,1052233253040640001,Twitter for iPhone,REGISTER TO https://t.co/0pWiwCHGbh! #MAGA🇺🇸 https://t.co/ACTMe53TZU,13118,44272,false,10-16-2018 16:22:11
2018,10,16,978,1052232230972678145,Twitter for iPhone,RT @WhiteHouse: https://t.co/RNqLpOtS3O,11298,0,true,10-16-2018 16:18:08
2018,10,16,926,1052219253384994816,Twitter for iPhone,Is it really possible that Bruce Ohr whose wife Nellie was paid by Simpson and GPS Fusion for work done on the Fake Dossier and who was used as a Pawn in this whole SCAM (WITCH HUNT) is still working for the Department of Justice????? Can this really be so?????,25246,83677,false,10-16-2018 15:26:33
2018,10,16,918,1052217314463100928,Twitter for iPhone,“Conflict between Glen Simpson’s testimony to another House Panel about his contact with Justice Department official Bruce Ohr. Ohr was used by Simpson and Steele as a Back Channel to get (FAKE) Dossier to FBI. Simpson pleading Fifth.” Catherine Herridge. Where is Jeff Sessions?,13204,46915,false,10-16-2018 15:18:51
2018,10,16,904,1052213711295930368,Twitter for iPhone,“Federal Judge throws out Stormy Danials lawsuit versus Trump. Trump is entitled to full legal fees.” @FoxNews Great now I can go after Horseface and her 3rd rate lawyer in the Great State of Texas. She will confirm the letter she signed! She knows nothing about me a total con!,29201,123960,false,10-16-2018 15:04:32
2018,10,16,852,1052200515608690688,Twitter for iPhone,Incredible number just out 7036000 job openings. Astonishing - it’s all working! Stock Market up big on tremendous potential of USA. Also Strong Profits. We are Number One in World by far!,23197,90204,false,10-16-2018 14:12:06
2018,10,16,795,1052186219696803841,Twitter for iPhone,For the record I have no financial interests in Saudi Arabia (or Russia for that matter). Any suggestion that I have is just more FAKE NEWS (of which there is plenty)!,20782,78339,false,10-16-2018 13:15:18
2018,10,16,788,1052184484941049857,Twitter for iPhone,“8X more new manufacturing jobs now than with Obama.” @FoxNews  @cvpayne,16006,69474,false,10-16-2018 13:08:24
2018,10,16,785,1052183647552491521,Twitter for iPhone,The United States has strongly informed the President of Honduras that if the large Caravan of people heading to the U.S. is not stopped and brought back to Honduras no more money or aid will be given to Honduras effective immediately!,42875,145186,false,10-16-2018 13:05:04
2018,10,16,775,1052181272137801728,Twitter for iPhone,“Op-Ed praises Trump Administrations efforts at the Border.” @FoxNews  The  Washington Examiner States “Finally the government has taken steps to stop releasing unaccompanied minors to criminals and traffickers.” This was done by the Obama Administration!,13627,53300,false,10-16-2018 12:55:38
2018,10,16,744,1052173526919196672,Twitter for iPhone,Thank you to the Cherokee Nation for revealing that Elizabeth Warren sometimes referred to as Pocahontas is a complete and total Fraud!,30543,124242,false,10-16-2018 12:24:51
2018,10,16,736,1052171444082360320,Twitter for iPhone,Now that her claims of being of Indian heritage have turned out to be a scam and a lie Elizabeth Warren should apologize for perpetrating this fraud against the American Public. Harvard called her “a person of color” (amazing con) and would not have taken her otherwise!,23423,92944,false,10-16-2018 12:16:35
2018,10,16,726,1052168909665824769,Twitter for iPhone,Pocahontas (the bad version) sometimes referred to as Elizabeth Warren is getting slammed. She took a bogus DNA test and it showed that she may be 1/1024 far less than the average American. Now Cherokee Nation denies her “DNA test is useless.” Even they don’t want her. Phony!,28891,123129,false,10-16-2018 12:06:31
2018,10,16,26,1051992718807830529,Twitter for iPhone,TOGETHER WE WILL PREVAIL! https://t.co/C1TLMVkDmt,19085,85653,false,10-16-2018 00:26:23
2018,10,15,1431,1051984061860904960,Twitter for iPhone,Open enrollment starts today on lower-priced Medicare Advantage plans so loved by our great seniors. Crazy Bernie and his band of Congressional Dems will outlaw these plans. Disaster!,20554,76874,false,10-15-2018 23:51:59
2018,10,15,1347,1051962675255603200,Twitter for iPhone,RT @WhiteHouse: Thank you to the law enforcement first responders and state local and Federal officials who are helping in recovery eff…,10682,0,true,10-15-2018 22:27:00
2018,10,15,1323,1051956730156994560,Twitter for iPhone,"RT @WhiteHouse: ""First responders @fema the job they've done is incredible"" President @realDonaldTrump said as he toured damage from #Hu…",9280,0,true,10-15-2018 22:03:23
2018,10,15,945,1051861686842474496,Twitter for iPhone,Just arrived in Florida. Also thinking about our GREAT Alabama farmers and our many friends in North and South Carolina today. We are with you!,13239,72224,false,10-15-2018 15:45:43
2018,10,15,828,1051832118165139458,Twitter for iPhone,On our way to Florida and Georgia!,9600,65364,false,10-15-2018 13:48:13
2018,10,15,757,1051814214212485120,Twitter for iPhone,Just spoke to the King of Saudi Arabia who denies any knowledge of whatever may have happened “to our Saudi Arabian citizen.” He said that they are working closely with Turkey to find answer. I am immediately sending our Secretary of State to meet with King!,21701,84090,false,10-15-2018 12:37:05
2018,10,15,745,1051811228362919938,Twitter for iPhone,Will be leaving for Florida and Georgia with the First Lady to tour the hurricane damage and visit with FEMA First Responders and Law Enforcement. Maximum effort is taking place everyone is working very hard. Worst hit in 50 years!,11921,62644,false,10-15-2018 12:25:13
2018,10,15,731,1051807774894624768,Twitter for iPhone,The crowds at my Rallies are far bigger than they have ever been before including the 2016 election. Never an empty seat in these large venues many thousands of people watching screens outside. Enthusiasm &amp; Spirit is through the roof. SOMETHING BIG IS HAPPENING - WATCH!,28421,118356,false,10-15-2018 12:11:29
2018,10,15,706,1051801524857384960,Twitter for iPhone,“The only way to shut down the Democrats new Mob Rule strategy is to stop them cold at the Ballot Box. The fight for America’s future is never over!” Ben Shapiro,27252,101203,false,10-15-2018 11:46:39
2018,10,14,1364,1051604811530072066,Twitter for iPhone,RT @realDonaldTrump: I will be interviewed on “60 Minutes” tonight at 7:00 P.M. after NFL game. Enjoy!,12355,0,true,10-14-2018 22:44:59
2018,10,14,1194,1051561865061502977,Twitter for iPhone,Thank you to NBC for the correction! https://t.co/L2mX3vREOl,19014,78510,false,10-14-2018 19:54:20
2018,10,14,1185,1051559539605164034,Twitter for iPhone,Thank you! https://t.co/CrExOML9Mi,14359,71927,false,10-14-2018 19:45:05
2018,10,14,1184,1051559350047821826,Twitter for iPhone,RT @IVT2020: @realDonaldTrump https://t.co/cvYbnieQ4H,7675,0,true,10-14-2018 19:44:20
2018,10,14,1179,1051558072433463297,Twitter for iPhone,I will be interviewed on “60 Minutes” tonight at 7:00 P.M. after NFL game. Enjoy!,12355,72290,false,10-14-2018 19:39:16
2018,10,14,1086,1051534671807467520,Twitter for iPhone,Will be interviewed tonight by @LesleyRStahl on @60Minutes @CBSNews at 7:30 P.M. Eastern. Enjoy! https://t.co/eUTAP0u0Uh,3645,14066,false,10-14-2018 18:06:16
2018,10,14,842,1051473226109513728,Twitter for iPhone,Princess Eugenie of York was a truly beautiful bride yesterday. She has been through so much and has come out a total winner!,10535,71284,false,10-14-2018 14:02:07
2018,10,14,836,1051471737068670977,Twitter for iPhone,NBC News has totally and purposely changed the point and  meaning of my story about General Robert E Lee and General Ulysses Grant. Was actually a shoutout to warrior Grant and the great state in which he was born. As usual dishonest reporting. Even mainstream media embarrassed!,31524,118931,false,10-14-2018 13:56:12
2018,10,14,233,1051319975795933184,Twitter for iPhone,Congratulations to Tucker Carlson on the great success of his book “Ship of Fools.” It just went to NUMBER ONE!,20649,101536,false,10-14-2018 03:53:09
2018,10,14,222,1051317348496490496,Twitter for iPhone,Big day! Pastor Andrew Brunson who could have spent 35 years in a Turkish prison was returned safely home to his family today. Met in Oval Office great people! Then off to Kentucky for a Rally for Congressman Andy Barr. Tremendous crowd &amp; spirit! Just returned to White House.,17174,88481,false,10-14-2018 03:42:43
2018,10,14,76,1051280606536105984,Twitter for iPhone,Thank you Kentucky! #MAGA🇺🇸https://t.co/iCUqrQ91gF https://t.co/xwsa1S2dIU,12951,56093,false,10-14-2018 01:16:43
2018,10,13,1266,1051217592554323973,Twitter for iPhone,On my way to Richmond Kentucky for a MAKE AMERICA GREAT AGAIN rally at 7:00pmE. The crowds are once again massive. See everyone in a couple of hours! #MAGA https://t.co/D1FYNgW0nL https://t.co/d0VBFeePLk,10086,46834,false,10-13-2018 21:06:19
2018,10,13,1248,1051213021115285504,Twitter for iPhone,WELCOME HOME PASTOR ANDREW BRUNSON! https://t.co/HijeAGU1gy,20085,87006,false,10-13-2018 20:48:09
2018,10,13,1242,1051211563946975233,Twitter for iPhone,https://t.co/uIaENHQoPK,11725,51097,false,10-13-2018 20:42:22
2018,10,13,1072,1051168800324931584,Twitter for iPhone,Heading to the Great State of Kentucky - Big Rally for Congressman Andy Barr - Fantastic guy need his vote for MAGA! Strong on Crime Tax Cuts Military Vets &amp; 2nd A. His opponent will NEVER vote for us only for Pelosi. Andy has my Strongest Endorsement!!! See you in Kentucky.,16086,72341,false,10-13-2018 17:52:26
2018,10,13,1063,1051166436029358081,Twitter for iPhone,Highly respected Congressman Keith Rothfus (R) of Pennsylvania is in the fight of his life because the Dems changed the District Map. He must win. Strong on crime borders big tax &amp; reg cuts Military &amp; Vets. Opponent Lamb a Pelosi puppet-weak on crime. BIG ENDORSEMENT FOR KEITH,26609,91598,false,10-13-2018 17:43:02
2018,10,13,1023,1051156386179141632,Twitter for iPhone,“From a Turkish prison to the White House in 24 hours.”  Kristin Fisher of @FoxNews   Very cool!,15023,73803,false,10-13-2018 17:03:06
2018,10,13,857,1051114825391239169,Twitter for iPhone,There was NO DEAL made with Turkey for the release and return of Pastor Andrew Brunson. I don’t make deals for hostages. There was however great appreciation on behalf of the United States which will lead to good perhaps great relations between the United States &amp; Turkey!,24536,101582,false,10-13-2018 14:17:57
2018,10,13,846,1051111923788513281,Twitter for iPhone,Pastor Andrew Brunson released by Turkey will be with me in the Oval Office at 2:30 P.M. (this afternoon). It will be wonderful to see and meet him. He is a great Christian who has been through such a tough experience. I would like to thank President @RT_Erdogan for his help!,17136,75280,false,10-13-2018 14:06:26
2018,10,13,811,1051103122163204097,Twitter for iPhone,Happy 243rd Birthday to our GREAT @USNavy! #243NavyBday https://t.co/m1YtoKSHFw,12713,57185,false,10-13-2018 13:31:27
2018,10,13,77,1050918295690465280,Twitter for iPhone,RT @realDonaldTrump: Don’t miss our GREAT @FLOTUS Melania on @ABC @ABC2020 tonight at 10pmE. Enjoy!,11257,0,true,10-13-2018 01:17:01
2018,10,13,30,1050906531162677248,Twitter for iPhone,Beautiful MAKE AMERICA GREAT AGAIN rally in Lebanon Ohio. Thank you! #ICYMI watch here: https://t.co/UGQAmARPKR https://t.co/6nsoV8yTx3,10638,48028,false,10-13-2018 00:30:16
2018,10,12,1334,1050872423317471232,Twitter for iPhone,The GREAT football (and lacrosse) player Jim Brown outside the West Wing of the @WhiteHouse. He is also a tremendous man and mentor to many young people! https://t.co/yo7MxoGL6C,21564,87883,false,10-12-2018 22:14:44
2018,10,12,1322,1050869299567562752,Twitter for iPhone,https://t.co/HHTwwbuKa2,10396,45161,false,10-12-2018 22:02:19
2018,10,12,1290,1050861279529893888,Twitter for iPhone,RT @WhiteHouse: https://t.co/IqLBKtgNEf,8953,0,true,10-12-2018 21:30:27
2018,10,12,1177,1050832839678353410,Twitter for iPhone,Happy #NationalFarmersDay! With the recent #USMCA our GREAT FARMERS will do better than ever before!! https://t.co/PMS4z2EScY,8398,38336,false,10-12-2018 19:37:27
2018,10,12,1150,1050826148131860480,Twitter for iPhone,Don’t miss our GREAT @FLOTUS Melania on @ABC @ABC2020 tonight at 10pmE. Enjoy!,11251,57063,false,10-12-2018 19:10:51
2018,10,12,1089,1050810652271529984,Twitter for iPhone,People have no idea how hard Hurricane Michael has hit the great state of Georgia. I will be visiting both Florida and Georgia early next week. We are working very hard on every area and every state that was hit - we are with you!,16976,82790,false,10-12-2018 18:09:17
2018,10,12,1003,1050788995377049601,Twitter for iPhone,PROMISES MADE PROMISES KEPT! https://t.co/2lk8Fjspe4,18566,60597,false,10-12-2018 16:43:13
2018,10,12,957,1050777580553588738,Twitter for iPhone,REGISTER TO VOTE! https://t.co/0pWiwCHGbh https://t.co/EOCLoJJ24B,13815,43308,false,10-12-2018 15:57:52
2018,10,12,866,1050754462405537798,Twitter for iPhone,PASTOR BRUNSON JUST RELEASED. WILL BE HOME SOON!,27625,125672,false,10-12-2018 14:26:00
2018,10,12,839,1050747691062493185,Twitter for iPhone,My thoughts and prayers are with Pastor Brunson and we hope to have him safely back home soon!,13840,77930,false,10-12-2018 13:59:06
2018,10,12,834,1050746600916754432,Twitter for iPhone,So nice everyone wants Ivanka Trump to be the new United Nations Ambassador. She would be incredible but I can already hear the chants of Nepotism! We have great people that want the job.,14131,76446,false,10-12-2018 13:54:46
2018,10,12,822,1050743405578457093,Twitter for iPhone,Working very hard on Pastor Brunson!,12514,68058,false,10-12-2018 13:42:04
2018,10,11,1369,1050518765828489217,Twitter for iPhone,RT @FLGuard: There are serious communication issues in the Panhandle after #HurricaneMichael. If you are worried about someone visit https…,6839,0,true,10-11-2018 22:49:26
2018,10,11,1334,1050509946880708611,Twitter for iPhone,RT @WhiteHouse: President Trump provides an update on the response to Hurricane Michael: https://t.co/zmnHXKakYw,6122,0,true,10-11-2018 22:14:23
2018,10,11,1043,1050436733039534080,Twitter for iPhone,RT @WhiteHouse: Moments ago President Trump signed the Music Modernization Act which will close loopholes in our digital royalty laws to…,15619,0,true,10-11-2018 17:23:27
2018,10,11,981,1050421238429077505,Media Studio,https://t.co/xJ9QYGMJXa,9063,42377,false,10-11-2018 16:21:53
2018,10,11,883,1050396488839430144,Media Studio,https://t.co/rsxEwbFZht,8973,38898,false,10-11-2018 14:43:33
2018,10,11,881,1050395852466995202,Media Studio,https://t.co/h47S6T9u8V,8797,39414,false,10-11-2018 14:41:01
2018,10,11,224,1050230507689189381,Twitter for iPhone,Florida Highway Patrol Troopers are all en route to the Panhandle from all across the state of Florida - to help those affected by #HurricaneMichael. If you see them be sure to shake their hands and say THANK YOU! #LESM https://t.co/rB7uNBudY5,18518,83413,false,10-11-2018 03:44:00
2018,10,11,95,1050198107969982464,Twitter for iPhone,Thank you to @FEMA and all First Responders! #HurricaneMichael https://t.co/vwN8BbrkkJ,9842,48376,false,10-11-2018 01:35:15
2018,10,11,93,1050197632524660736,Twitter for iPhone,Thank you Jacksonville Sheriff’s Office! #HurricaneMichael https://t.co/fuy7stLMJI,10402,47413,false,10-11-2018 01:33:21
2018,10,11,60,1050189312904581120,Twitter for iPhone,Massive overflow crowd tonight in Erie Pennsylvania. THANK YOU to everyone who came out and joined us. Together we are MAKING AMERICA GREAT AGAIN! https://t.co/FkPNNVpccX,23802,92539,false,10-11-2018 01:00:18
2018,10,11,52,1050187347860627456,Twitter for iPhone,Thank you Erie Pennsylvania! Remember to get out and VOTE! #MAGA🇺🇸 https://t.co/X8IEW8h9qP,11285,46233,false,10-11-2018 00:52:29
2018,10,10,1353,1050152447119908864,Twitter for iPhone,RT @fema: It’s extremely important to keep sheltering in a safe place and to stay aware as #Michael continues to move inland! https://t.co/…,3700,0,true,10-10-2018 22:33:48
2018,10,10,1353,1050152401112637440,Twitter for iPhone,RT @USNationalGuard: LIVE UPDATE: @AlabamaNG @GeorgiaGuard @FLGuard and @NCNationalGuard vehicles and personnel are staged and ready to p…,3249,0,true,10-10-2018 22:33:37
2018,10,10,1265,1050130133410045952,Twitter for iPhone,RT @WhiteHouse: Earlier today: President @realDonaldTrump joined by Homeland Security @SecNielsen listens as @FEMA_Brock briefs reporters…,4652,0,true,10-10-2018 21:05:08
2018,10,10,1261,1050129323724816388,Twitter for iPhone,Couldn’t let these great people down. They have been lined up since last night - see you soon Pennsylvania! https://t.co/jSrsmncw85,11788,53981,false,10-10-2018 21:01:55
2018,10,10,1192,1050111823842893824,Twitter for iPhone,Departing the @WhiteHouse for Erie Pennsylvania. I cannot disappoint the thousands of people that are there - and the thousands that are going. I look forward to seeing everyone this evening.,14890,80036,false,10-10-2018 19:52:23
2018,10,10,1059,1050078505705373697,Twitter for iPhone,RT @USATODAY: .@usatodayopinion: Democrats want to outlaw private health care plans taking away freedom to choose plans while letting anyo…,9280,0,true,10-10-2018 17:39:59
2018,10,10,1012,1050066499342401536,Twitter for iPhone,RT @FLGuard: #HurricaneMichael is here but so are we. Stay safe Florida. #FloridaFirst #FLNGAlwaysThere https://t.co/e2rVNXFERp,5454,0,true,10-10-2018 16:52:17
2018,10,10,1003,1050064211919933442,Twitter for iPhone,RT @EricTrump: All my friends in Missouri today is your LAST CHANCE to register to vote this November! It is very easy to do - simply go t…,7141,0,true,10-10-2018 16:43:12
2018,10,10,965,1050054830843199490,Twitter for iPhone,We are with you Florida! https://t.co/qzrVLeFbyFhttps://t.co/HVVhSmBg7S https://t.co/rcB6OCwLeH,12172,53793,false,10-10-2018 16:05:55
2018,10,10,781,1050008315286171648,Twitter for iPhone,Despite so many positive events and victories Media Reseach Center reports that 92% of stories on Donald Trump are negative on ABC CBS and ABC. It is FAKE NEWS! Don’t worry the Failing New York Times didn’t even put the Brett Kavanaugh victory on the Front Page yesterday-A17!,25499,93308,false,10-10-2018 13:01:05
2018,10,10,770,1050005763152904193,Twitter for iPhone,RT @NHC_Surge: A destructive and life-threatening storm surge event will occur along portions of the Florida Panhandle Big Bend and Natur…,4057,0,true,10-10-2018 12:50:56
2018,10,10,770,1050005552443609088,Twitter for iPhone,RT @FAANews: Due to #HurricaneMichael flights in your area could be delayed and possibly cancelled. Please continue to check the status of…,2816,0,true,10-10-2018 12:50:06
2018,10,10,769,1050005309467611136,Twitter for iPhone,RT @FLSERT: Hurricane shelter locations are accessible from: https://t.co/Hop887IoiC #HurricaneMichael https://t.co/Ljk8boFaSw,3060,0,true,10-10-2018 12:49:08
2018,10,10,768,1050005273279127553,Twitter for iPhone,RT @NHC_Atlantic: Hurricane #Michael.  In addition to the life-threatening storm surge and wind impacts heavy rainfall is expected across…,2980,0,true,10-10-2018 12:48:59
2018,10,10,768,1050005197102157825,Twitter for iPhone,RT @NHC_Atlantic: Hurricane force winds are expected to extend well inland over portions of the Florida Panhandle and portions of southeast…,2983,0,true,10-10-2018 12:48:41
2018,10,10,768,1050005131968827396,Twitter for iPhone,RT @NHC_Atlantic: A Storm Surge Warning remains in effect for much of the Florida Panhandle and Big Bend region where life-threatening sto…,2553,0,true,10-10-2018 12:48:26
2018,10,10,768,1050005069234692096,Twitter for iPhone,RT @NHC_Atlantic: NHC Director Ken Graham will provide a Facebook Live broadcast regarding Category 4 Hurricane #Michael at 8:45 a.m. EDT (…,2359,0,true,10-10-2018 12:48:11
2018,10,10,767,1050005011562926080,Twitter for iPhone,RT @fema: As Hurricane #Michael nears land take shelter &amp; stay safe.📱Follow weather updates on your phone or radio.🔹 In a tornado WARN…,4417,0,true,10-10-2018 12:47:57
2018,10,10,767,1050004777034309633,Twitter for iPhone,Walker Stapleton is running as the highly respected Republican Candidate for Governor of the Great State of Colorado. His credentials and talents are impeccable. He has my complete and total Endorsement!,14545,57022,false,10-10-2018 12:47:01
2018,10,10,148,1049849039418679296,Twitter for iPhone,RT @FLGovScott: If you’re in an evacuation zone I am urging you to leave RIGHT NOW. Do not risk your life or the lives of your loved ones-…,9412,0,true,10-10-2018 02:28:10
2018,10,10,83,1049832845592723457,Twitter for iPhone,THANK YOU IOWA &amp; NEBRASKA! VOTE VOTE VOTE! https://t.co/0pWiwCHGbh https://t.co/tzkiQ4IlEd,13172,54312,false,10-10-2018 01:23:49
2018,10,10,78,1049831428115062790,Twitter for iPhone,https://t.co/CPf3oxgdRX,8122,34233,false,10-10-2018 01:18:12
2018,10,10,69,1049829285677203456,Twitter for iPhone,Beautiful evening in Iowa. GOD BLESS THE U.S.A.! #MAGA🇺🇸 https://t.co/Zi0rwyajrz,18514,78472,false,10-10-2018 01:09:41
2018,10,09,1338,1049786137500217345,Twitter for iPhone,RT @fema: Flooding from Hurricane #Michael will affect several states. Finish preparations ASAP and get ready to shelter in a safe location…,4856,0,true,10-09-2018 22:18:13
2018,10,09,1319,1049781519424712704,Twitter for iPhone,RT @FLOTUS: Thank you Egypt 🇪🇬 🇺🇸 https://t.co/7i0POn29XN,18218,0,true,10-09-2018 21:59:52
2018,10,09,1319,1049781513347194880,Twitter for iPhone,RT @FLOTUS: Thank you Kenya 🇰🇪 🇺🇸 https://t.co/5FXP7Ki3Zw,15837,0,true,10-09-2018 21:59:51
2018,10,09,1299,1049776359239643136,Twitter for iPhone,.@FLGovScott has been relentless in securing the funding to fix the algae problem from Lake Okeechobee - we will solve this! Congress must follow through on the Government’s plan on the Everglades Reservoir. Bill Nelson has been no help!,14657,57361,false,10-09-2018 21:39:22
2018,10,09,1294,1049775219693375489,Twitter for iPhone,RT @Scavino45: Congratulations to our 114th Supreme Court Justice Brett M. Kavanaugh! #SCOTUS🏛🇺🇸🔟📸https://t.co/c3YdNNcU7c https://t.co/A…,6101,0,true,10-09-2018 21:34:50
2018,10,09,1148,1049738503389675521,Twitter for iPhone,“President Donald J. Trump Approves Florida Emergency Declaration” https://t.co/TnTDCvs41W,7724,34804,false,10-09-2018 19:08:57
2018,10,09,996,1049700215949860864,Twitter for iPhone,REGISTER TO VOTE! https://t.co/0pWiwCHGbh https://t.co/3vYfDmpqiH,17992,48430,false,10-09-2018 16:36:48
2018,10,09,967,1049692727582048258,Twitter for iPhone,FLORIDA - It is imperative that you heed the directions of your State and Local Officials. Please be prepared be careful and be SAFE! #HurricaneMichael https://t.co/VP6PBXfzm9 https://t.co/aKmaDNgZve,11483,45318,false,10-09-2018 16:07:03
2018,10,09,960,1049690974841135104,Twitter for iPhone,...Looks to be a Cat. 3 which is even more intense than Florence. Good news is the folks in the Pan Handle can take care of anything. @FEMA and First Responders are ready - be prepared! #HurricaneMichael,5960,28349,false,10-09-2018 16:00:05
2018,10,09,960,1049690971934511104,Twitter for iPhone,Hurricane on its way to the Florida Pan Handle with major elements arriving tomorrow. Could also hit in later stage parts of Georgia and unfortunately North Carolina and South Carolina again...,8742,37931,false,10-09-2018 16:00:04
2018,10,09,858,1049665483182694402,Twitter for iPhone,Big announcement with my friend Ambassador Nikki Haley in the Oval Office at 10:30am.,13417,66424,false,10-09-2018 14:18:47
2018,10,09,803,1049651531346321408,Twitter for iPhone,RT @realDonaldTrump: https://t.co/4ySIkmfllE,18078,0,true,10-09-2018 13:23:21
2018,10,09,790,1049648174896504832,Twitter for iPhone,Will be going to Iowa tonight for Rally and more! The Farmers (and all) are very happy with USMCA!,11636,55642,false,10-09-2018 13:10:01
2018,10,09,757,1049640099007356928,Twitter for iPhone,Great evening last night at the White House honoring Justice Kavanaugh and family. Our country is very proud of them!,15959,89845,false,10-09-2018 12:37:55
2018,10,09,752,1049638803177127936,Twitter for iPhone,The paid D.C. protesters are now ready to REALLY protest because they haven’t gotten their checks - in other words they weren’t paid! Screamers in Congress and outside were far too obvious - less professional than anticipated by those paying (or not paying) the bills!,25502,94224,false,10-09-2018 12:32:46
2018,10,09,739,1049635559000469504,Twitter for iPhone,RT @NWSTallahassee: 8am Intermediate Advisory from @NHC_Atlantic upgrades #HurricaneMichael into a category 2 hurricane. Keep in mind wind…,4127,0,true,10-09-2018 12:19:53
2018,10,09,738,1049635249431437313,Twitter for iPhone,RT @fema: ⚠️If you're told to evacuate for Hurricane #Michael don't delay. Leave as soon as possible. Listen to @FLSERT and local offici…,4655,0,true,10-09-2018 12:18:39
2018,10,09,94,1049473255151755264,Twitter for iPhone,https://t.co/4ySIkmfllE,18081,74171,false,10-09-2018 01:34:56
2018,10,08,1423,1049445228694962176,Twitter for iPhone,https://t.co/k2bOxapRtR,15092,58921,false,10-08-2018 23:43:34
2018,10,08,1184,1049385141557030912,Twitter for iPhone,Great to see @AGPamBondi launch a cutting-edge statewide school safety APP in Florida today - named by Parkland Survivors. BIG PRIORITY and Florida is getting it done! #FortifyFL,11014,48534,false,10-08-2018 19:44:49
2018,10,08,1177,1049383326975373312,Twitter for iPhone,Every day our police officers race into darkened allies deserted streets &amp; onto the doorsteps of the most hardened criminals. They see the worst of humanity &amp; they respond with the best of the American Spirit. America’s LEOs have earned the everlasting gratitude of our Nation! https://t.co/RquS91Vz7o,15026,61252,false,10-08-2018 19:37:36
2018,10,08,1167,1049380830395609090,Twitter for iPhone,We thank you. We salute you. We honor you. And we promise you: we will ALWAYS have your BACK – now and FOREVER! #IACP2018 https://t.co/nvUUIuvouj,15246,66208,false,10-08-2018 19:27:41
2018,10,08,1137,1049373138130280449,Twitter for iPhone,America’s police officers have earned the everlasting gratitude of our Nation. In moments of danger &amp; despair you are the reason we never lose hope – because there are men &amp; women in uniform who face down evil &amp; stand for all that is GOOD and JUST and DECENT and RIGHT! #IACP2018 https://t.co/N0Dq50DkbP,16053,70979,false,10-08-2018 18:57:07
2018,10,08,1112,1049367031433383936,Twitter for iPhone,It was my great honor to address the International Association of Chiefs of Police Annual Convention in Orlando Florida. Thank you! #IACP2018 #LESM https://t.co/Z0nY5bSNr6,9518,44503,false,10-08-2018 18:32:51
2018,10,08,931,1049321480780099584,Twitter for iPhone,Departing Washington D.C. for the International Association of Chiefs of Police Annual Convention in Orlando Florida. Look forward to seeing everyone soon! #IACP2018 https://t.co/EwSd7IU9t1,8270,43063,false,10-08-2018 15:31:51
2018,10,08,816,1049292375330361345,Twitter for iPhone,Christopher Columbus’s spirit of determination &amp; adventure has provided inspiration to generations of Americans. On #ColumbusDay we honor his remarkable accomplishments as a navigator &amp; celebrate his voyage into the unknown expanse of the Atlantic Ocean. https://t.co/Mg3dxRfPuN,19213,76200,false,10-08-2018 13:36:11
2018,10,07,1095,1049000243168206848,Twitter for iPhone,RT @FLOTUS: Thank you Kenya 🇰🇪 🇺🇸 https://t.co/JrHncob8Qp,20079,0,true,10-07-2018 18:15:22
2018,10,07,882,1048946652621541377,Twitter for iPhone,.@SecPompeo had a good meeting with Chairman Kim today in Pyongyang. Progress made on Singapore Summit Agreements! I look forward to seeing Chairman Kim again in the near future. https://t.co/bUa2pkq80s,19807,87311,false,10-07-2018 14:42:25
2018,10,07,81,1048745061888880640,Twitter for iPhone,You don’t hand matches to an arsonist and you don’t give power to an angry left-wing mob. Democrats have become too EXTREME and TOO DANGEROUS to govern. Republicans believe in the rule of law - not the rule of the mob. VOTE REPUBLICAN!,67746,228025,false,10-07-2018 01:21:22
2018,10,07,75,1048743461543763969,Twitter for iPhone,Beautiful evening in Topeka Kansas. VOTE VOTE VOTE! #MAGA https://t.co/bomRqsaYfm,15263,69247,false,10-07-2018 01:15:00
2018,10,07,49,1048737154778759168,Twitter for iPhone,Thank you Kansas - I love you! https://t.co/ymCFNr9WQY,15474,73059,false,10-07-2018 00:49:56
2018,10,06,1317,1048693669870501889,Twitter for iPhone,The crowd in front of the U.S. Supreme Court is tiny looks like about 200 people (&amp; most are onlookers) - that wouldn’t even fill the first couple of rows of our Kansas Rally or any of our Rallies for that matter! The Fake News Media tries to make it look sooo big &amp; it’s not!,37880,162935,false,10-06-2018 21:57:09
2018,10,06,1215,1048668088059584512,Twitter for iPhone,I applaud and congratulate the U.S. Senate for confirming our GREAT NOMINEE Judge Brett Kavanaugh to the United States Supreme Court. Later today I will sign his Commission of Appointment and he will be officially sworn in. Very exciting!,62475,262765,false,10-06-2018 20:15:30
2018,10,06,1206,1048665701513187328,Twitter for iPhone,I have asked Steve Daines our great Republican Senator from Montana to attend his daughter Annie’s wedding rather than coming to today’s vote. Steve was ready to do whatever he had to but we had the necessary number. To the Daines Family congratulations-have a wonderful day!,28008,156497,false,10-06-2018 20:06:01
2018,10,06,968,1048606042123395072,Twitter for iPhone,Women for Kavanaugh and many others who support this very good man are gathering all over Capitol Hill in preparation for a 3-5 P.M. VOTE. It is a beautiful thing to see - and they are not paid professional protesters who are handed expensive signs. Big day for America!,29482,132372,false,10-06-2018 16:08:57
2018,10,06,880,1048583880326963200,Twitter for iPhone,Women for Kavanaugh and many others who support this very good man are gathering all over Capital Hill in preparation for a 3-5 P.M. VOTE. It is a beautiful thing to see - and they are not paid professional protesters who are handed expensive signs. Big day for America!,15505,56869,false,10-06-2018 14:40:53
2018,10,06,226,1048419104594558976,Twitter for iPhone,RT @realDonaldTrump: Thank you Minnesota - I love you!https://t.co/eQC2NqdIil,17892,0,true,10-06-2018 03:46:07
2018,10,05,1289,1048324424020254725,Twitter for iPhone,RT @FLOTUS: Thank you Malawi! 🇺🇸 🇲🇼 https://t.co/rE03LMNzOZ,19621,0,true,10-05-2018 21:29:54
2018,10,05,1289,1048324404856414209,Twitter for iPhone,RT @FLOTUS: Thank you Ghana! 🇺🇸 🇬🇭 https://t.co/d34cqFyRdN,20351,0,true,10-05-2018 21:29:49
2018,10,05,899,1048226225196552193,Twitter for iPhone,Very proud of the U.S. Senate for voting “YES” to advance the nomination of Judge Brett Kavanaugh!,40450,199902,false,10-05-2018 14:59:41
2018,10,05,786,1048197648807854080,Twitter for iPhone,Just out: 3.7% Unemployment is the lowest number since 1969!,37512,159724,false,10-05-2018 13:06:08
2018,10,05,783,1048196883464818688,Twitter for iPhone,The very rude elevator screamers are paid professionals only looking to make Senators look bad. Don’t fall for it! Also look at all of the professionally made identical signs. Paid for by Soros and others. These are not signs made in the basement from love! #Troublemakers,53468,179025,false,10-05-2018 13:03:06
2018,10,05,689,1048173268438536192,Twitter for iPhone,RT @RealJamesWoodss: Whether you love or hate him Trump’s ascendancy to the presidency was a once-in-a-century miracle. He was literally t…,31272,0,true,10-05-2018 11:29:15
2018,10,05,688,1048172962094964736,Twitter for iPhone,RT @newsobserver: Presidential adviser and daughter @IvankaTrump will make 3 stops in NC to see hurricane relief efforts thank first respo…,5509,0,true,10-05-2018 11:28:02
2018,10,05,685,1048172372778471424,Twitter for iPhone,RT @Scavino45: 🚨Happening Now | 2:08amE; Our great @FLOTUS Melania Trump...visiting a Kenyan elephant orphanage...https://t.co/rW2cWXaswf,7954,0,true,10-05-2018 11:25:42
2018,10,05,63,1048015772214353921,Twitter for iPhone,Beautiful evening in Rochester Minnesota. VOTE VOTE VOTE! https://t.co/SyxrxvTpZE,15500,70217,false,10-05-2018 01:03:25
2018,10,05,52,1048012979357270017,Twitter for iPhone,Thank you Minnesota - I love you!https://t.co/eQC2NqdIil,17899,82812,false,10-05-2018 00:52:20
2018,10,04,1378,1047984297607618565,Twitter for iPhone,Just made my second stop in Minnesota for a MAKE AMERICA GREAT AGAIN rally. We need to elect @KarinHousley to the U.S. Senate and we need the strong leadership of @TomEmmer @Jason2CD @JimHagedornMN and @PeteStauber in the U.S. House!,14343,60313,false,10-04-2018 22:58:21
2018,10,04,1337,1047974091318149120,Twitter for iPhone,Congressman Bishop is doing a GREAT job! He helped pass tax reform which lowered taxes for EVERYONE! Nancy Pelosi is spending hundreds of thousands of dollars on his opponent because they both support a liberal agenda of higher taxes and wasteful spending!,17129,70888,false,10-04-2018 22:17:48
2018,10,04,1169,1047931723302887424,Twitter for iPhone,“U.S. Stocks Widen Global Lead” https://t.co/Snhv08ulcO,12858,52687,false,10-04-2018 19:29:27
2018,10,04,1157,1047928708172894208,Twitter for iPhone,Statement on National Strategy for Counterterrorism: https://t.co/ajFBg9Elsj https://t.co/Qr56ycjMAV,10910,40060,false,10-04-2018 19:17:28
2018,10,04,1058,1047903710389534720,Twitter for iPhone,Working hard thank you! https://t.co/6HQVaEXH0I,21889,95626,false,10-04-2018 17:38:08
2018,10,04,857,1047853098365079553,Twitter for iPhone,This is now the 7th. time the FBI has investigated Judge Kavanaugh. If we made it 100 it would still not be good enough for the Obstructionist Democrats.,30705,122924,false,10-04-2018 14:17:01
2018,10,04,841,1047849122672390146,Twitter for iPhone,RT @ChatByCC: While armed with the power of our Vote we proudly &amp; peacefully revoltedNever doubt this was an American revolution#MAGA…,13793,0,true,10-04-2018 14:01:13
2018,10,04,834,1047847548600377344,Twitter for iPhone,This is a very important time in our country. Due Process Fairness and Common Sense are now on trial!,28178,115007,false,10-04-2018 13:54:58
2018,10,04,814,1047842341246173185,Twitter for iPhone,Our country’s great First Lady Melania is doing really well in Africa. The people love her and she loves them! It is a beautiful thing to see.,23172,134529,false,10-04-2018 13:34:16
2018,10,04,736,1047822816580722690,Twitter for iPhone,The harsh and unfair treatment of Judge Brett Kavanaugh is having an incredible upward impact on voters. The PEOPLE get it far better than the politicians. Most importantly this great life cannot be ruined by mean &amp; despicable Democrats and totally uncorroborated allegations!,34356,139389,false,10-04-2018 12:16:41
2018,10,04,143,1047673458241560576,Twitter for iPhone,Wow such enthusiasm and energy for Judge Brett Kavanaugh. Look at the Energy look at the Polls. Something very big is happening. He is a fine man and great intellect. The country is with him all the way!,37889,157867,false,10-04-2018 02:23:11
2018,10,04,1,1047637712004636673,Twitter for iPhone,My thoughts and prayers are with the Florence County Sheriff’s Office and the Florence Police Department tonight in South Carolina. We are forever grateful for what our Law Enforcement Officers do 24/7/365. https://t.co/ZwDmDthItD,20749,85256,false,10-04-2018 00:01:09
2018,10,03,875,1047495435760427008,Twitter for iPhone,Just spoke to President-Elect Andres Manuel Lopez Obrador of Mexico. Great call we will work well together!,14191,70909,false,10-03-2018 14:35:48
2018,10,03,869,1047493831426498561,Twitter for iPhone,I see it each time I go out to Rallies in order to help some of our great Republican candidates. VOTERS ARE REALLY ANGRY AT THE VICIOUS AND DESPICABLE WAY DEMOCRATS ARE TREATING BRETT KAVANAUGH! He and his wonderful family deserve much better.,26592,103846,false,10-03-2018 14:29:25
2018,10,03,853,1047489875614883841,Twitter for iPhone,Mexico Canada and the United States are a great partnership and will be a very formidable trading force. We will now because of the USMCA work very well together. Great Spirit!,14469,69609,false,10-03-2018 14:13:42
2018,10,03,845,1047487803746074624,Twitter for iPhone,Blowout numbers on New Jobs and separately Services. Market up!,13208,62615,false,10-03-2018 14:05:28
2018,10,03,842,1047486972976095233,Twitter for iPhone,Thank you to Congressman Tom Reed of New York for your wonderful comments on our great new Trade Deal with Mexico and Canada the USMCA. I have long ago given you my Full Endorsement and for good reason. Keep up the Great Work! @Varneyco,9885,47553,false,10-03-2018 14:02:10
2018,10,03,803,1047477260624773121,Twitter for iPhone,Thank you Governor Phil Bryant - it was my great honor to be there! #MAGA https://t.co/UbY7Qu2fMt,9832,47201,false,10-03-2018 13:23:34
2018,10,03,796,1047475390573371395,Twitter for iPhone,https://t.co/w04sqlMIYm,10432,43757,false,10-03-2018 13:16:08
2018,10,03,784,1047472342354604033,Twitter for iPhone,The Stock Market just reached an All-Time High during my Administration for the 102nd Time a presidential record by far for less than two years. So much potential as Trade and Military Deals are completed.,20538,91906,false,10-03-2018 13:04:02
2018,10,03,773,1047469711938736128,Twitter for iPhone,The Failing New York Times did something I have never seen done before. They used the concept of “time value of money” in doing a very old boring and often told hit piece on me. Added up this means that 97% of their stories on me are bad. Never recovered from bad election call!,18236,81741,false,10-03-2018 12:53:35
2018,10,03,755,1047465256023445504,Twitter for iPhone,Congressman @PeteSessions of Texas is a true fighter and patriot. Highly respected in D.C. by all he always gets what his district and our country wants and needs. Strong on Crime Border Military Vets and 2nd Amendment. Pete has my Full and Total Endorsement. A great guy!,12374,53036,false,10-03-2018 12:35:52
2018,10,03,236,1047334526622597120,Twitter for iPhone,RT @DHSgov: REMINDER: Tomorrow 10/3 at 2:18 PM EDT there will be a nationwide test of the Wireless Emergency Alert system in coordinatio…,10821,0,true,10-03-2018 03:56:24
2018,10,03,178,1047319923700060161,Twitter for iPhone,Thank you Mississippi - Together we are MAKING AMERICA GREAT AGAIN! https://t.co/npnRirjcFG,11026,51047,false,10-03-2018 02:58:22
2018,10,03,138,1047309776374259712,Twitter for iPhone,Today my Administration provided HISTORIC levels of funding to improve school safety through STOP School Violence grants – a top priority for @sandyhook. I am committed to keeping our children SAFE in their schools!,17730,76326,false,10-03-2018 02:18:03
2018,10,03,135,1047309022892707841,Twitter for iPhone,“National wage growth is at the highest it’s been in nearly 17 months -- and according to a new study released by Glassdoor it’s not expected to slow down anytime soon....” https://t.co/G0Ts6yVqF9,12636,52131,false,10-03-2018 02:15:03
2018,10,03,85,1047296564388147200,Twitter for iPhone,GOD BLESS THE U.S.A.! #MAGA🇺🇸 https://t.co/pquqyy5S3G,21274,84510,false,10-03-2018 01:25:33
2018,10,03,78,1047294700246454273,Twitter for iPhone,Thank you Mississippi - I love you! https://t.co/eH6x1NBNQG,11406,51334,false,10-03-2018 01:18:08
2018,10,02,1280,1047234792532529152,Twitter for iPhone,This is really an incredible time for our Nation - WE are RESPECTED AGAIN! https://t.co/94KusYcDAj,15582,69554,false,10-02-2018 21:20:05
2018,10,02,1277,1047234049192775680,Twitter for iPhone,RT @WhiteHouse: “America will always be a nation of great builders because in America we honor work we honor grit we honor craftsmanshi…,12612,0,true,10-02-2018 21:17:08
2018,10,02,1098,1047189115689754624,Twitter for iPhone,“USMCA Wins Praise as a Victory for American Industries and Workers”➡️https://t.co/UWhPhNXiiL https://t.co/eBVv0nXXRT,9715,43190,false,10-02-2018 18:18:35
2018,10,02,1042,1047175026259189761,Twitter for iPhone,Proud of our great First Lady - and she loves doing this! https://t.co/VD7wlqeJoR,18653,90565,false,10-02-2018 17:22:36
2018,10,02,978,1047159010632355842,Twitter for iPhone,Yesterday it was my great honor to present the Medal of Honor to Ronald J. Shurer II for his actions on April 6 2008 when he braved enemy fire to treat multiple injured Soldiers. Read more: https://t.co/Nrrcp2JJUL https://t.co/A0KLHmIPZs,12195,56312,false,10-02-2018 16:18:58
2018,10,02,968,1047156358343282688,Twitter for iPhone,THE ONLY REASON TO VOTE FOR A DEMOCRAT IS IF YOU’RE TIRED OF WINNING!,45533,169591,false,10-02-2018 16:08:25
2018,10,02,902,1047139656066842625,Twitter for iPhone,Great reviews on the new USMCA. Thank you! Mexico and Canada will be wonderful partners in Trade (and more) long into the future.,15267,74222,false,10-02-2018 15:02:03
2018,10,02,892,1047137342924959744,Twitter for iPhone,Happy 7th birthday to Tristan a very special member of the Trump family!,11979,85333,false,10-02-2018 14:52:52
2018,10,02,50,1046925327958708226,Twitter for iPhone,WOW - THANK YOU TENNESSEE! https://t.co/38UUDqfIz5,27116,115528,false,10-02-2018 00:50:23
2018,10,02,37,1046922163457011712,Twitter for iPhone,Thank you Tennessee - I love you! https://t.co/1swpoY7F5x,15901,73602,false,10-02-2018 00:37:49
2018,10,02,25,1046919122351792128,Twitter for iPhone,https://t.co/5UmYGFLyLK,12299,47787,false,10-02-2018 00:25:44
2018,10,01,728,1046733574173544448,Twitter for iPhone,News conference on the USMCA this morning at 11:00 - Rose Garden of White House.,12285,64636,false,10-01-2018 12:08:26
2018,10,01,656,1046715439831797760,Twitter for iPhone,Congratulations to Mexico and Canada!,19069,103661,false,10-01-2018 10:56:22
2018,10,01,653,1046714711268622336,Twitter for iPhone,....deficiencies and mistakes in NAFTA greatly opens markets to our Farmers and Manufacturers reduces Trade Barriers to the U.S. and will bring all three Great Nations together in competition with the rest of the world. The USMCA is a historic transaction!,18158,79307,false,10-01-2018 10:53:28
2018,10,01,640,1046711423227842560,Twitter for iPhone,.....deficiencies and mistakes in NAFTA greatly opens markets to our Farmers and Manufacturers reduce Trade Barriers to the U.S. and will bring all three Great Nations closer together in competition with the rest of the world. The USMCA is a historic transaction!,1921,6809,false,10-01-2018 10:40:24
2018,10,01,630,1046708836407685122,Twitter for iPhone,Late last night our deadline we reached a wonderful new Trade Deal with Canada to be added into the deal already reached with Mexico. The new name will be The United States Mexico Canada Agreement or USMCA. It is a great deal for all three countries solves the many......,29266,130680,false,10-01-2018 10:30:08
2018,09,30,1136,1046473870650290176,Twitter for iPhone,Wow! Just starting to hear the Democrats who are only thinking Obstruct and Delay are starting to put out the word that the “time” and “scope” of FBI looking into Judge Kavanaugh and witnesses is not enough. Hello! For them it will never be enough - stay tuned and watch!,38728,143678,false,09-30-2018 18:56:27
2018,09,30,1067,1046456403651698693,Twitter for iPhone,So if African-American unemployment is now at the lowest number in history median income the highest and you then add all of the other things I have done how do Democrats who have done NOTHING for African-Americans but TALK win the Black Vote?  And it will only get better!,34994,139081,false,09-30-2018 17:47:03
2018,09,30,1017,1046443996074127361,Twitter for iPhone,Like many I don’t watch Saturday Night Live (even though I past hosted it) - no longer funny no talent or charm. It is just a political ad for the Dems. Word is that Kanye West who put on a MAGA hat after the show (despite being told “no”) was great. He’s leading the charge!,47164,224633,false,09-30-2018 16:57:45
2018,09,30,169,1046230634103025664,Twitter for iPhone,NBC News incorrectly reported (as usual) that I was limiting the FBI investigation of Judge Kavanaugh and witnesses only to certain people. Actually I want them to interview whoever they deem appropriate at their discretion. Please correct your reporting!,46089,161884,false,09-30-2018 02:49:55
2018,09,30,52,1046201064469549056,Twitter for iPhone,Thank you West Virginia - I love you! https://t.co/Ou2umCfKp9,17942,85256,false,09-30-2018 00:52:25
2018,09,30,51,1046200796944191499,Twitter for iPhone,https://t.co/BxlF4grr9k,15685,63307,false,09-30-2018 00:51:22
2018,09,29,1236,1046136712987103241,Twitter for iPhone,Heading to West Virginia now. Big Rally. Will be live on @FoxNews tonight. Long lines but will be great!,13787,75762,false,09-29-2018 20:36:43
2018,09,29,1233,1046135994267963392,Twitter for iPhone,Senator Richard Blumenthal must talk about his fraudulent service in Vietnam where for 12 years he told the people of Connecticut as their Attorney General that he was a great Marine War Hero. Talked about his many battles of near death but was never in Vietnam. Total Phony!,47287,144621,false,09-29-2018 20:33:51
2018,09,29,27,1045832351211835392,Twitter for iPhone,Just started tonight our 7th FBI investigation of Judge Brett Kavanaugh. He will someday be recognized as a truly great Justice of The United States Supreme Court!,41667,180972,false,09-29-2018 00:27:17
2018,09,27,1366,1045444544068812800,Twitter for iPhone,Judge Kavanaugh showed America exactly why I nominated him. His testimony was powerful honest and riveting. Democrats’ search and destroy strategy is disgraceful and this process has been a total sham and effort to delay obstruct and resist. The Senate must vote!,86383,325730,false,09-27-2018 22:46:17
2018,09,26,1432,1045098909352235008,Twitter for iPhone,https://t.co/9o5gZlJiTd,17832,80067,false,09-26-2018 23:52:51
2018,09,26,1248,1045052439521624067,Twitter for iPhone,Join me this Saturday in Wheeling West Virginia at 7pmE! Tickets: https://t.co/JyRaBps0eR https://t.co/hiruLIxa7w,14737,55293,false,09-26-2018 20:48:12
2018,09,26,1247,1045052203784962049,Twitter for iPhone,RT @WhiteHouse: President Trump and Prime Minister Theresa May met for a bilateral meeting in New York 🇺🇸 🇬🇧 https://t.co/VdJztUmD9T,8086,0,true,09-26-2018 20:47:16
2018,09,26,1163,1045031027444514818,Twitter for iPhone,RT @WhiteHouse: This afternoon President Trump participated in a bilateral meeting with Prime Minister Abe. 🇺🇸🇯🇵 https://t.co/PvSINQY7yq,8297,0,true,09-26-2018 19:23:07
2018,09,26,1163,1045031013372579841,Twitter for iPhone,RT @WhiteHouse: Earlier today President Trump participated in a bilateral meeting with Prime Minister @netanyahu of Israel. 🇺🇸🇮🇱 https://t…,8798,0,true,09-26-2018 19:23:03
2018,09,26,1054,1045003711104331776,Twitter for iPhone,Congressman Lee Zeldin is doing a fantastic job in D.C. Tough and smart he loves our Country and will always be there to do the right thing. He has my Complete and Total Endorsement!,15266,67512,false,09-26-2018 17:34:34
2018,09,26,1051,1045002980574089216,Twitter for iPhone,RT @PeteHegseth: This @realDonaldTrump speech to the #UNGA should be required viewing in American high schools. A beautiful articulation of…,18151,0,true,09-26-2018 17:31:40
2018,09,26,1048,1045002283556253698,Twitter for iPhone,RT @newtgingrich: President Trump’s United Nations speech today is a remarkable outline of the power of patriotism the importance of natio…,18659,0,true,09-26-2018 17:28:54
2018,09,26,1046,1045001780092956672,Twitter for iPhone,China is actually placing propaganda ads in the Des Moines Register and other papers made to look like news. That’s because we are beating them on Trade opening markets and the farmers will make a fortune when this is over! https://t.co/ppdvTX7oz1,19745,60946,false,09-26-2018 17:26:54
2018,09,26,1007,1044991766309621760,Twitter for iPhone,Avenatti is a third rate lawyer who is good at making false accusations like he did on me and like he is now doing on Judge Brett Kavanaugh. He is just looking for attention and doesn’t want people to look at his past record and relationships - a total low-life!,35738,141289,false,09-26-2018 16:47:06
2018,09,26,657,1044903785125089281,Twitter for iPhone,Jobless Claims fell to their lowest level in 49 years!,21074,97677,false,09-26-2018 10:57:30
2018,09,26,654,1044903153987203072,Twitter for iPhone,Consumer confidence hits an 18 year high close to breaking the all-time record. A big jump from last 8 years. People are excited about the USA again! We are getting Bigger and Richer and Stronger. WAY MORE TO GO!,20970,93513,false,09-26-2018 10:54:59
2018,09,26,175,1044782444321361920,Twitter for iPhone,The Democrats are playing a high level CON GAME in their vicious effort to destroy a fine person. It is called the politics of destruction. Behind the scene the Dems are laughing. Pray for Brett Kavanaugh and his family!,35616,129723,false,09-26-2018 02:55:20
2018,09,26,158,1044778309362622466,Twitter for iPhone,“These law enforcement people took the law into their own hands when it came to President Trump.” @LindseyGrahamSC,13788,58145,false,09-26-2018 02:38:54
2018,09,25,1326,1044709771629260801,Twitter for iPhone,73rd Session of the United Nations General Assembly #UNGA https://t.co/xJyx7RrH5F,12670,54068,false,09-25-2018 22:06:33
2018,09,25,1227,1044684820478119936,Twitter for iPhone,“Consumer confidence rose in September notching its highest level in about 18 years. The Consumer Board's index rose to 138.4 this month from 134.7 in August...” https://t.co/ZbxjnrRvAX,13751,56345,false,09-25-2018 20:27:25
2018,09,25,1168,1044669976672698373,Twitter for iPhone,“Remarks by President Trump at a Luncheon Hosted by the Secretary-General of the United Nations” https://t.co/ShHaLmoSDL https://t.co/k62KGgD8j6,10038,42374,false,09-25-2018 19:28:26
2018,09,25,1039,1044637590719221762,Twitter for iPhone,“Remarks by President Trump to the 73rd Session of the United Nations General Assembly” ➡️https://t.co/Oshhko61zY https://t.co/Fm8LSse417,9837,41771,false,09-25-2018 17:19:44
2018,09,25,1005,1044628997999665153,Twitter for iPhone,Rush Limbaugh to Republicans: “You can kiss the MIDTERMS goodbye if you don’t get highly qualified Kavanaugh approved.”,27655,98407,false,09-25-2018 16:45:36
2018,09,25,997,1044627015662538752,Twitter for iPhone,Thank you Dr. Jeffress! https://t.co/cm7NjQh0ti,14530,59173,false,09-25-2018 16:37:43
2018,09,25,996,1044626591463215104,Twitter for iPhone,Thank you Mark! https://t.co/NVGs6WbQe2,15966,73261,false,09-25-2018 16:36:02
2018,09,25,927,1044609366970814465,Twitter for iPhone,https://t.co/h43dehf0WV,13732,46446,false,09-25-2018 15:27:35
2018,09,25,794,1044575765109624832,Twitter for iPhone,Will be speaking at the United Nations this morning. Our country is much stronger and much richer than it was when I took office less than two years ago. We are also MUCH safer!,16481,87416,false,09-25-2018 13:14:04
2018,09,25,653,1044540438806482944,Twitter for iPhone,Despite requests I have no plans to meet Iranian President Hassan Rouhani. Maybe someday in the future. I am sure he is an absolutely lovely man!,15903,82445,false,09-25-2018 10:53:41
2018,09,25,641,1044537328415506432,Twitter for iPhone,Republican Party Favorability is the highest it has been in 7 years - 3 points higher than Democrats!  Gallup,17347,78719,false,09-25-2018 10:41:20
2018,09,25,170,1044418753671417860,Twitter for iPhone,The Democrats are working hard to destroy a wonderful man and a man who has the potential to be one of our greatest Supreme Court Justices ever with an array of False Accusations the likes of which have never been seen before!,31100,117233,false,09-25-2018 02:50:09
2018,09,25,158,1044415858465001472,Twitter for iPhone,REMEMBER THE MIDTERMS!,30701,111077,false,09-25-2018 02:38:39
2018,09,25,157,1044415685928120321,Twitter for iPhone,The Democrats are working hard to destroy a wonderful man and a man who has the potential to be one of our greatest Supreme Court Justices ever with an array of False Acquisitions the likes of which have never been seen before!,3565,11393,false,09-25-2018 02:37:58
2018,09,25,22,1044381661331410944,Twitter for iPhone,https://t.co/FXqSWusSTV,12219,52036,false,09-25-2018 00:22:46
2018,09,24,1421,1044371304395276288,Twitter for iPhone,It was my great honor to welcome President @EmmanuelMacron of France to the United States here in New York City this evening! #UNGA https://t.co/Gd7pCBFUCg,7901,39869,false,09-24-2018 23:41:37
2018,09,24,1373,1044359089525063680,Twitter for iPhone,RT @realDonaldTrump: Brett Kavanaugh and his wife Ashley will be interviewed tonight at 7pmE on @marthamaccallum @FoxNews. This is an out…,12517,0,true,09-24-2018 22:53:04
2018,09,24,1353,1044354203089547265,Twitter for iPad,It was my great honor to welcome President @AlsisiOfficial of Egypt to the United States this afternoon in New York City. Great meetings! #UNGA https://t.co/dsMZWodpWr,8065,37377,false,09-24-2018 22:33:39
2018,09,24,1306,1044342304155348995,Twitter for iPhone,Joint Statement on the United States-Korea Free Trade Agreement: https://t.co/m0jW8nqdQW https://t.co/lcrhsJtv00,8909,38349,false,09-24-2018 21:46:22
2018,09,24,1293,1044339078257356801,Twitter for iPhone,Brett Kavanaugh and his wife Ashley will be interviewed tonight at 7pmE on @marthamaccallum @FoxNews. This is an outstanding family who must be treated fairly!,19635,88465,false,09-24-2018 21:33:33
2018,09,24,1244,1044326708151820289,Twitter for iPhone,US-Korea Free Trade Agreement Signing Ceremony! https://t.co/yLFkAZgagG,14143,54891,false,09-24-2018 20:44:24
2018,09,24,1242,1044326197424009223,Twitter for iPhone,It was my great honor to welcome and meet with President @moonriver365 Jae-in of South Korea today in New York City! https://t.co/7f3eOYGxDn #UNGA https://t.co/B6rVeeBTCc,9128,37245,false,09-24-2018 20:42:22
2018,09,24,1015,1044269053274193920,Twitter for iPhone,Today we commit to fighting the drug epidemic together! #UNGA https://t.co/XgaYTOBrSK,13011,58615,false,09-24-2018 16:55:18
2018,09,24,857,1044229324075929600,Twitter for iPhone,“Remarks by President Trump at ‘Global Call to Action on the World Drug Problem’ Event” #UNGA➡️https://t.co/kvUZegWdlH https://t.co/BGdrQeZuId,8425,37008,false,09-24-2018 14:17:26
2018,09,24,853,1044228299579428864,Twitter for iPhone,RT @SCEMD: Now is the time to put safety first above everything else. Evacuate to a shelter if you need to take your pets with you. Your l…,4093,0,true,09-24-2018 14:13:22
2018,09,23,1368,1043995561895108609,Twitter for iPhone,Prime Minster @AbeShinzo is coming up to Trump Tower for dinner but most importantly he just had a great landslide victory in Japan. I will congratulate him on behalf of the American people!,18536,91097,false,09-23-2018 22:48:33
2018,09,23,1252,1043966388182953984,Twitter for iPhone,Going to New York. Will be with Prime Minister Abe of Japan tonight talking Military and Trade. We have done much to help Japan would like to see more of a reciprocal relationship. It will all work out!,18634,92351,false,09-23-2018 20:52:37
2018,09,23,1243,1043964186034868224,Twitter for iPhone,Tiger is playing great. Looks like a big win could happen. Very exciting! @TigerWoods,16564,105913,false,09-23-2018 20:43:52
2018,09,22,1179,1043585537058181122,Twitter for iPhone,https://t.co/qZSEifBNaP,14761,64956,false,09-22-2018 19:39:15
2018,09,22,896,1043514401477877766,Twitter for iPhone,https://t.co/MgkotGmkJ0,16027,68303,false,09-22-2018 14:56:35
2018,09,22,841,1043500433271066625,Twitter for iPhone,New Economic Records being set on a daily basis - and it is not by accident!,22389,104524,false,09-22-2018 14:01:05
2018,09,22,200,1043339305593139200,Twitter for iPhone,GOD BLESS THE U.S.A.! https://t.co/n9OkDlqz11,24984,102429,false,09-22-2018 03:20:49
2018,09,22,193,1043337448850317313,Twitter for iPhone,RT @RSBNetwork: President @realDonaldTrump absolutely packs the house at JQH Arena in Springfield MO. #TrumpRally #RedWave https://t.co/1c…,16185,0,true,09-22-2018 03:13:26
2018,09,22,191,1043337056754102272,Twitter for iPhone,"RT @dcexaminer: ""We are standing up for your values"" Trump said closing his rally in Springfield Missouri. ""We are standing up for our na…",9828,0,true,09-22-2018 03:11:53
2018,09,22,189,1043336550333833222,Twitter for iPhone,RT @juliehdavis: For 2nd night in row at Trump rally (tonite in Springfield last nite in Las Vegas) crowd spontaneously breaks into cheer…,13067,0,true,09-22-2018 03:09:52
2018,09,22,189,1043336436676681729,Twitter for iPhone,"RT @FoxBusiness: .@POTUS: ""The stock market is up 55%... Your 401(k)s are up 50 60 70% in some cases."" https://t.co/g38SD65pMW",9346,0,true,09-22-2018 03:09:25
2018,09,22,91,1043311845635833856,Twitter for iPhone,Thank you Missouri - Together we are MAKING AMERICA GREAT AGAIN! https://t.co/onl1HmM2Gz,12958,56881,false,09-22-2018 01:31:42
2018,09,22,65,1043305127250194432,Twitter for iPhone,Thank you Missouri - I love you!https://t.co/rx3mtd7yOy,14715,60424,false,09-22-2018 01:05:00
2018,09,21,1304,1043254590290911232,Twitter for iPhone,Remarks by President Trump at the Signing of H.R. 5895: https://t.co/tfKJJGMevo https://t.co/7hcD22Txvy,7928,35143,false,09-21-2018 21:44:11
2018,09,21,1251,1043241388580646912,Twitter for iPhone,https://t.co/hIw1AQdRpY,12382,53503,false,09-21-2018 20:51:44
2018,09,21,1226,1043235155169566720,Twitter for iPhone,RT @W7VOA: View of the line outside Las Vegas Convention Center of those waiting to get into the @realDonaldTrump #MAGA rally. (Photos sent…,9255,0,true,09-21-2018 20:26:58
2018,09,21,1225,1043234744962437120,Twitter for iPhone,RT @RamonaGiwargis: The crowd roars as @realDonaldTrump takes the stage. Says he’s thrilled to be back in Ne-vah-da. “You have to say that…,7671,0,true,09-21-2018 20:25:20
2018,09,21,1224,1043234493648142336,Twitter for iPhone,RT @MikeTokes: What an amazing Trump rally in Las Vegas Nevada. There must have been over 10000 people here and trust me when I say it w…,14891,0,true,09-21-2018 20:24:20
2018,09,21,1224,1043234467844771840,Twitter for iPhone,RT @MikeTokes: We are outside the Trump rally in Las Vegas. There are THOUSANDS of conservatives here and the line extends all the way arou…,8396,0,true,09-21-2018 20:24:14
2018,09,21,1223,1043234204232835072,Twitter for iPhone,RT @NVGOP: Energy and excitement for President @realDonaldTrump and his #AmericaFirst agenda is through the roof! #MAGA https://t.co/KNywCE…,6531,0,true,09-21-2018 20:23:11
2018,09,21,1222,1043233954575208449,Twitter for iPhone,RT @GOP: “We’re fighting every day for our factories our ranchers our great miners our farmers and we are now the largest producer of e…,7990,0,true,09-21-2018 20:22:11
2018,09,21,1221,1043233767219912709,Twitter for iPhone,RT @LindseyGrahamSC: Great job tonight by President @realDonaldTrump in Las Vegas laying out how strong America has become economically and…,13744,0,true,09-21-2018 20:21:27
2018,09,21,1211,1043231338482921472,Twitter for iPhone,Promises Kept for our GREAT Veterans! https://t.co/C0h8cW4FuH,11313,46450,false,09-21-2018 20:11:48
2018,09,21,1042,1043188755866079232,Twitter for iPhone,Throughout American history the men and women of our Armed Forces have selflessly served our Country making tremendous sacrifices to defend our liberty. On National POW/MIA Recognition Day we honor all American Prisoners of War: https://t.co/ZGiqdYbats https://t.co/OEetrLzgcJ,11154,44353,false,09-21-2018 17:22:35
2018,09,21,929,1043160312315146240,Twitter for iPhone,Senator Feinstein and the Democrats held the letter for months only to release it with a bang after the hearings were OVER - done very purposefully to Obstruct &amp; Resist &amp; Delay. Let her testify or not and TAKE THE VOTE!,27377,93775,false,09-21-2018 15:29:34
2018,09,21,925,1043159406685212672,Twitter for iPhone,Senator Feinstein and the Democrats  held the letter for months only to release it with a bang after the hearings were OVER - done very purposefully to Obstruct &amp; Resist &amp; Delay. Let her testify or not and TAKE THE VOTE!,453,1294,false,09-21-2018 15:25:58
2018,09,21,881,1043148165883416576,Twitter for iPhone,....has been asked to review these documents on an expedited basis. I believe he will move quickly on this (and hopefully other things which he is looking at). In the end I can always declassify if it proves necessary. Speed is very important to me - and everyone!,17077,68524,false,09-21-2018 14:41:18
2018,09,21,875,1043146627576258561,Twitter for iPhone,I met with the DOJ concerning the declassification of various UNREDACTED documents. They agreed to release them but stated that so doing may have a perceived negative impact on the Russia probe. Also key Allies’ called to ask not to release. Therefore the Inspector General.....,15646,57752,false,09-21-2018 14:35:11
2018,09,21,814,1043131309671899136,Twitter for iPhone,RT @trueamerica1st: @realDonaldTrump https://t.co/w7EBsA5aTT,16108,0,true,09-21-2018 13:34:19
2018,09,21,813,1043131046437376000,Twitter for iPhone,RT @trueamerica1st: https://t.co/02E9bG17Mf,8650,0,true,09-21-2018 13:33:16
2018,09,21,809,1043130170612244481,Twitter for iPhone,The radical left lawyers want the FBI to get involved NOW. Why didn’t someone call the FBI 36 years ago?,17345,82298,false,09-21-2018 13:29:47
2018,09,21,803,1043128595231604738,Twitter for iPhone,I will Chair the United Nations Security Council meeting on Iran next week!,15739,70044,false,09-21-2018 13:23:32
2018,09,21,794,1043126336473055235,Twitter for iPhone,I have no doubt that if the attack on Dr. Ford was as bad as she says charges would have been immediately filed with local Law Enforcement Authorities by either her or her loving parents. I ask that she bring those filings forward so that we can learn  date time and place!,26944,112683,false,09-21-2018 13:14:33
2018,09,21,776,1043121858797686785,Twitter for iPhone,Judge Brett Kavanaugh is a fine man with an impeccable reputation who is under assault by radical left wing politicians who don’t want to know the answers they just want to destroy and delay. Facts don’t matter. I go through this with them every single day in D.C.,30090,115495,false,09-21-2018 12:56:46
2018,09,21,245,1042988257166819329,Twitter for iPhone,AMERICA IS WINNING AGAIN! https://t.co/6HcBjLAAQB,19607,80377,false,09-21-2018 04:05:52
2018,09,21,213,1042980109907451905,Twitter for iPhone,Thank you Las Vegas Nevada - I love you! #MAGA🇺🇸 https://t.co/GBZO84PyQ1,11035,49581,false,09-21-2018 03:33:30
2018,09,21,209,1042978990229606401,Twitter for iPhone,MAKE AMERICA GREAT AGAIN!https://t.co/OYJUkiEUid,14071,54099,false,09-21-2018 03:29:03
2018,09,21,87,1042948464408055808,Twitter for iPhone,Landing in Las Vegas now for a Make America Great Again Rally supporting @DeanHeller and @DannyTarkanian. Also doing interview there with @seanhannity live on @FoxNews. Big crowd long lines. Will be great! #MAGA,10819,53644,false,09-21-2018 01:27:45
2018,09,20,1437,1042925680109924352,Twitter for iPhone,https://t.co/LdXQb42Imc,12819,43126,false,09-20-2018 23:57:13
2018,09,20,1314,1042894836024586240,Twitter for iPhone,On my way to Las Vegas Nevada. Look forward to seeing everyone tonight! #MAGA https://t.co/wTeerIUJvd,12565,56712,false,09-20-2018 21:54:39
2018,09,20,1114,1042844399300952064,Twitter for iPhone,https://t.co/RzqoiQ4SmD,13549,54037,false,09-20-2018 18:34:14
2018,09,20,1090,1042838324187213824,Twitter for iPhone,...North Korea to be identified as a result of my Summit with Chairman Kim. These HEROES are home they may Rest In Peace and hopefully their families can have closure.,11472,51690,false,09-20-2018 18:10:06
2018,09,20,1090,1042838322530398214,Twitter for iPhone,Army Master Sgt. Charles H. McDaniel 32 of Vernon Indiana and Army Pfc. William H. Jones 19 of Nash County North Carolina are the first American remains from...,13116,55813,false,09-20-2018 18:10:05
2018,09,20,1059,1042830534513229825,Twitter for iPhone,Congratulations to my good friend Prime Minister @AbeShinzo on his HUGE election victory in Japan. I’m looking forward to many more years of working together. See you in New York next week!🇺🇸🇯🇵,15879,70497,false,09-20-2018 17:39:08
2018,09,20,1050,1042828275121369088,Twitter for iPhone,.@JayWebberNJ is running for Congress in the 11th District of New Jersey. He is outstanding in every way. Strong on Borders loves our Military and our Vets. Big Crime fighter. Jay has my Full and Total Endorsement!,11518,43372,false,09-20-2018 17:30:10
2018,09,20,814,1042768904857247744,Twitter for iPhone,S&amp;P 500 HITS ALL-TIME HIGH  Congratulations USA!,20664,91225,false,09-20-2018 13:34:15
2018,09,20,703,1042740913968164864,Twitter for iPhone,I want to know where is the money for Border Security and the WALL in this ridiculous Spending Bill and where will it come from after the Midterms? Dems are obstructing Law Enforcement and Border Security. REPUBLICANS MUST FINALLY GET TOUGH!,30789,116676,false,09-20-2018 11:43:01
2018,09,20,697,1042739629139664896,Twitter for iPhone,....The thing that’s lacking is we can’t properly secure the Border because of the Democrats historic level of Obstruction.” Senator David Perdue of Georgia.,13338,54759,false,09-20-2018 11:37:55
2018,09,20,692,1042738383720726528,Twitter for iPhone,“We can’t secure the Border because of the Democrats historic level of Obstruction. The Presidents fed up with this. His agenda is working. The economy is growing at twice the rate it did under Obama. We’ve nominated and confirmed 68 Federal Judges 26 Court of Appeals Judges....,15740,61589,false,09-20-2018 11:32:58
2018,09,20,673,1042733544466989057,Twitter for iPhone,We protect the countries of the Middle East they would not be safe for very long without us and yet they continue to push for higher and higher oil prices! We will remember. The OPEC monopoly must get prices down now!,20287,82533,false,09-20-2018 11:13:44
2018,09,20,665,1042731410858168320,Twitter for iPhone,Financial and jobs numbers are fantastic. There are plenty of new high paying jobs available in our great and very vibrant economy. If you are not happy where you are start looking - but also remember our economy is only getting better. Vote in Midterms!,17888,71801,false,09-20-2018 11:05:16
